link,recordID,timestamp,pwa,cer,fulltext_org,pageUUID,editionUUID,titleUUID,editionId,familyId,newspaper_page,newspaper_edition,lplace,location_name,location_coordinates,sentiment
http://www2.statsbiblioteket.dk/mediestream/avis/record/doms_aviser_page%3Auuid%3A3531c6c0-1d0d-4caa-9eb7-d672436e7901,doms_newspaperCollection:uuid:3531c6c0-1d0d-4caa-9eb7-d672436e7901-segment_3,1862-02-01T01:00:00Z,54,0.46,"jeg selv erhvervet mig, og mine Sloegtninge have saaletes ikke Spor af Ret til at indespcrrre mig ter hele min Levetid, for at de efter min Dod kunne faae alle Pengene. Jeg bar altid roeret en god Disponent eg Forretningsmand og bar aldrig gjort mig siyltig i nogensombclst ødselhed — — — — "", og saaletes fortscrtter Brevet, idet det afviser alle Professor Jessens frem sorte Beviser sor Facklams Afsindighed. (Fk. Av.) I den senest i Sondcrdcich afbrcvndte Marskgaard mistede Eieren, Hr. C. I. Meister, I>n ncrstcn nye Bvgning, alt Korn- og Fodcrfor- raad. hele Bcscrtningcn — 40 til 50 Stykker Ovcrg, flere Heste og 8 a 10Kocr — og Ind- boet, som dog var, endstjendt ikke tilstrcrkkeligt. forsikkrct i Clberfeld. Derimod brcrntte ogsaa Kisterne med Tjenestefolkenes Klcrdcr, som vare uforsikkrcdc. Paa en Tit, der er saa ncrringslos for Ar- beidsbesolkiiingcn ialmindcligbcd, og bror den of- fcnllige og private Velgjorenbed nepve vil rare istand til at tilfredsstille Trangen, bekjendtgjor Kratsuldfabricant MarruS G. Bech i Aarbuus, at ban mangler Arbejdere paa sin Fabrik, hvor hans opvarmede cg oplyste Arbcitssale staae saa godt som ledige, og saaletes have de staact i flere Aar. Hr. B. kan strar bestjcrstige 50 og flere qvindelige Arbejdere, dog kun saadanne, som virkelig ville bolde sig stadige til Arbeidet. og in- degaser ban da sor en Arbejdsfortjeneste as 2 Mk. pr. Tag, beregnet til 10 Arbejdstimer eller c. 3 si. vr. Time. Sortcre-Salcii, som kun be- staacr af 7 Platte, bar ban hidtil ikke kunnet faae hesat med stadige Arbejdere, og det uagtet Arbejdsfortjenesten har vcrrct og er fra 2 Mk. til 3 Mk. pr. Tag, beregnet til 10 Timer. Han mangler til denne 3 a 4 stadige Arbejdere, der flink kunne bruge Hamlerne. De fattige men flittige Arbejdere fra Nabobyerne Skaatc, Holme, Vibv og Hasle, som i flere Aar bavc fundet de- res Regning ved selv at afhente det raae Mate- tcriale og tilbagelevere det i forcrdlcr Tilstand, og som cre taknemmelige og tilfredse med, efter deres Lejlighed, at kunne fortjene 1 a 2 Rd. om Ugen og tog passe deres Huse, stullc fremdeleS erholde tilstrcrkkeligt Arbcidc. (Ab. Av.) Ulykke i et Bjcrgvcrrk. Atter bar der i et Bjerg-",doms_aviser_page:uuid:3531c6c0-1d0d-4caa-9eb7-d672436e7901,doms_aviser_edition:uuid:429ab9ac-faef-4080-a900-ad2dbd62d4a9,doms_aviser_title:uuid:7f6084e3-521f-433b-8451-73a897cdc053,viborgstiftstidende 1862-02-01 001,viborgstiftstidende,3,1,Viborg,Bjerg\nHolme\nHasle,"8.21016559636,56.5959006216\n9.40232556897,56.7882275319\n9.06445668544,54.9824376212\n10.1811459832,56.1111327875\n8.75186921768,56.8177639304\n9.69428804852,56.5285486202\n9.97400353631,55.3981751211\n10.7495890556,56.2401524175\n10.1556043343,56.1689171062\n14.7047147041,55.1854278329",10.652248677248677
http://www2.statsbiblioteket.dk/mediestream/avis/record/doms_aviser_page%3Auuid%3A83e00690-b85e-47f4-b9d9-404a01801a3c,doms_newspaperCollection:uuid:83e00690-b85e-47f4-b9d9-404a01801a3c-segment_5,1862-02-28T01:00:00Z,55.6,0.444,"Kaierfk Ol\nas anerkjcndt fortrinlig O.valitet — fra Volz- gens Bryggeri — saaeS paa halve Flaffcr 8 H. hos Martin Fischer.\nBarbecrknive hnulslibes og opsæit.s,\nligeledes modtages Lomnieknive og Sare til Slib- ning af N. Stottrnp.\nFormedelst anden Bestemmelse er en fortrinlig Eien- dom til Salg og kan af dens Eier hobes paa meget favorable Bilkaar, idet dens halve Kjobesum kan blive indcstaaende i Eiendommcn. der har et Areal af circa 17 Tonder Land udmærket Muldlord, med Leer Underlag, som alt i de senere Aar er merglet. Besætningen er 6 Kreaturer og nogle Faae; Hart- kornet er' circa 3 Skjcpper; Torvcjorb haves i Over- stod. Stuehuset bestaaer af 0 Fag ny Grundmuur og Floihuset af » Fag Bindingsværk. Liebhavere ville behage at henvende sig til Eieren. Lillegraaffou i Thorning Sogn pr. Viborg. Christian Christensen. Tirsdagen den Ilte Marts forstkommende. Kl. II Formiddag, bliver paa Byens Raadftne afholdt en eriraordinair Skiftesamling i afkode Enkefru Ane Cathrine Guldborgs og tidligere afgangne MandS Agent og Fabrikeier Peter Guldbergs Dodsbo, hvorunder vil blive forhandlet hvorvidt et af en De- bitor indkommet Forstag om Moderat on i hans Gjæld til Boet kan tages ril Folge samt fremsagt Rcgnstad over Farveriets Drift; — hvilket herved bekicnttgjorcs. Viborg KlebstadS Skifteret, ten 25te Febr. 1862. Zingelmann.\nSkriftlig Licitation.\nEfternævnte Arbejder og Leverancer, som udfordres til Anlæget i anstundinde Sommer af en Havn og 2de Færgekroer ved Ottesund i Thisted og Ring- kiobing Amter, nemlig: 1) Udgravning og Opmiidring af Havnen og denS Indlod til en Dybde af 8 Fod under daglig Vandstand (Opniudringsmasien c. 190 Cbfv.) 2) Alt til Anlæget horende Nedramnings- og Tom- merarbejde, faasom Redramning af c. 530 Stkr. 45"" Bolværks- og Anterpæle, >60 Sikr. g"" Dos- seringsxæle samt Tilretning og Anbringelse af c. 2650 lob. Alen Hammer, g"" Vandliste, 2"" Ankerbjelke og l"" Ankerrigel in. m. 3) Leverance af c 600oPd. forardcircl Smedegods, destaaende af Skruebolte, Spidsbolie. Bcstag m. m. 4) Leverance af c. 401, :«>«> Sikr. Plathoredsom samt dis'es Jndfiagning i Bolværkspælene, udbydes til Oreriagelfc paa de for samme gjeldende Eondiifonrr, der fra I6de Dennes henligge til Efter- fpn dos Jngenieurcapitain Dalgas i AarhuuS, In- genicurcapitain Christensen i Aalborg og Under- tegnede, paa hvis Eontoir tilltgc Tegninger og Over« flag forevises og Eremplarcr as Eonditionerne paa Forlangende udleveres eller tilsendes Rcqvirenterne. Forseglede skriftlige Bud mærkede: ...Havneanlægrt ved Oltrsund"" paa hver af Numcrnc i, 2 og 3 fa nt paa Rr. 4 — det hele Parti under Eet cller mindre Dele deraf, dog ikke under oo,o»>o Stkr. — modtages indtil den 7de MartS d. A. af Undertegnede i Holstebro. Prisen opgives pr. Pund i Budene paa Nr 3 og pr. looo Sikr. i Budene paa 4. De indkomne Bud aadnes i Lttefunds Færgcgaard paa Thyholm den 8de Maris d. A. Eftermiddag Kl. 2. Holstebro, den l2ie Februar 1862. N ph ol m, Jngenieurlieutenant.",doms_aviser_page:uuid:83e00690-b85e-47f4-b9d9-404a01801a3c,doms_aviser_edition:uuid:ded1dc70-ffb1-4dd8-a767-91736443e960,doms_aviser_title:uuid:7f6084e3-521f-433b-8451-73a897cdc053,viborgstiftstidende 1862-02-28 001,viborgstiftstidende,4,1,Viborg,Thyholm\nHammer\nHolstebro\nViborg\nBoet\nThisted\nAalborg\nThorning\nByen\nGuldborg,"8.53960514168,56.6445340961\n10.1152856718,56.0452435875\n9.45348309758,55.8953737929\n12.0567053311,55.7521371242\n11.8692442061,55.1455175932\n8.63897406887,56.3592965446\n9.40176695552,56.4443347362\n15.0333976293,55.1336209692\n8.69167981655,56.9557183058\n8.68798958196,56.9526457458\n9.51414281618,56.4538569133\n9.93146311931,57.025292765\n9.91683917278,57.0428743893\n9.33065137778,56.2867683127\n8.39276925385,55.4329764527\n11.7457540218,54.8698914485",15.925925925925911
http://www2.statsbiblioteket.dk/mediestream/avis/record/doms_aviser_page%3Auuid%3Aaf1d52bd-12db-420e-bc74-065c36a0680a,doms_newspaperCollection:uuid:af1d52bd-12db-420e-bc74-065c36a0680a-segment_1,1862-02-28T01:00:00Z,51.8,0.482,"og Maleren Kornerup, til Etebtt for at kebe Arbeiberne ved Udgravningen. Kisten stod i Hoicn lige paa Jorden, omgiven af Leer cg Steen. Liget, rer forinden Beroringen laae fuldstoendig i Kisten dlev strar aftegnet. Liget var r. 3000 Aar gammelt, fra Broncealdercn, hvilket bevistes ved et Brcncesvcrrd og flere Ting, ter fandtes, og det sees bcraf, at Ligene ikke allid, som man hidtil har troet, paa den Tid bkeve breonbte. Manden rar ifert et Skjcrt nicd Snore omkring Livet, hvori et Sverrb med Traskede, paa Hovedet en Krigsbne af ejendommeligt Arbejde meget tyk og ligesom flettet af Traad og Filt, en me- get stor Kappe af moderne Snit, med korte Haar. Under Hovedet cg ved Fodrerne laae et sammenlagt Klade, kantet med Fryndser. (5» As ske as Kurv.flctning, omtrent 0 Tommer i Tiameter og lige saa hci, indeholdt en almindelig Hue. i hvil- ke» fandtes en mindre AZske as Spa an, hvori laae en Kam, en Broncekniv m. m. Ved Fod- dernc laae der Rester as Sandaler, hvcras La- teret var sortaret. Selve Liget var blcren til en fedtagtig Jordmasse, hvori Benene rare blevne forandrede til en blaa Snbstants lpbosphcisniir Jernilte). Markeligt nok. rare Haarene, Hjerneskallen og en Tantkrcne bevaretr, hvilke som en stor Markrlighed bleve afleverede til det ehir- urgiske Academi. Alle disse Sager ere »u vel praparerede opstillede i Museet i et sareget Skab som en as te sjeltncste Markelighcder, Museet eicr. lFk. Av.) Oehlcnschlcigers Grav paa Frederiksberg Kirkegaard har nu endelig faact ten Ligsten, den i saa mange Aar har savnet. Tet er en pragtig, flad, brunn Granitblok, der barer Tig- terms Navn : „Adam Gottlob Tehlenscblagcr"". hans Fotsels- og Torsdag, og nedenunder Nav- net paa hans tidligere afkode Hustru. Grav- stenen er fljankct as Boghandler Dahl i tZbristi- aiiia, en af Oehlenschlagers Venner og Bcnn- drcre. (Bl. Td.j Til Vertensiitstillingeii i London sender D a »- mark 103 Kunstvarker; Danmark-S les- vig taller 101 In t u str i nd st i ll ere (166 fra Kongeriget, '25 fra Slesvig), Holsten 70. Norge sender 272 Nu mere. (<Zft. Tbl.j Dhrr. Schasser st Walckor ! Berlin have lost Patent paa e» ny Maate at producere Gas af Tjare, Harpir, Jordolie, Torv, Brunkul og an- tre lignende Materialicr i Forbindelse med Vant. Denne nye Gas. som Patenthaverne kalde Hy- dro-Carbon-Gas. er lettere at producere, bran- der bedre og er endeel billigere end den hidtil brugte Steenkulsgas. (Rt. Av.) I Newyork er med meget Bifald opfort en af Atv. Stallknecht ssra Horsens be- sorget tylfl Oversættelse af den danske Paurc- ville „Slægtningene"" ; om kort Tid opsores „Aprilsnarrene"". (Eft. Dbl.) Som et smukt Trak af det velvillige Forholt. der finder Sted paa fi.rc Godser heri Landet, kan ansores, at den Eolletifke Familie efter Af- hoendelsen af det den ved Kammerherre P. Col- letts Tot tilsaldne Gcds, „Orcmandsgaart"" i det sydlige Sjerlland, har stiftet et Legat as 1000 Rt. i kgl. Obligationer, hvis Renter i Fremtiden skulle tilfalde Godsets Fattige i Allerslev og Mchrc Sogne. Til samme Tid har Familien sijcrnket Kirlen i AlterSlev, der horer til Gcdsct, meget vcrrdisulde Solvkar til Prydelse og Asbe- nyttelse ved Alteret. (Fly.) Fra Sor o have vi i Onsdags saaet det Bud- skab, at Bernhard Severin Ingemann efter nogle saa Dages Sygeleje i Mantags Af- tes Kl. 101 er rolig hensovet, nerstcn 73 Aar gammel. Uagtet han i Tigterbegavelse stod til- bage for fine lidt oelbre Samtidige Oehlcnscblagcr og Grundtvig og i fln Ungdom blev ligesaamc- get overvurderet af ten Forsteg Modstandere, som i fin Alderdom af den sidstes Venner, efterlader",doms_aviser_page:uuid:af1d52bd-12db-420e-bc74-065c36a0680a,doms_aviser_edition:uuid:ded1dc70-ffb1-4dd8-a767-91736443e960,doms_aviser_title:uuid:7f6084e3-521f-433b-8451-73a897cdc053,viborgstiftstidende 1862-02-28 001,viborgstiftstidende,2,1,Viborg,Adam\nNorge\nFly\nHorsens\nHovedet\nBerlin\nFrederiksberg\nSlesvig\nJorden\nTing\nKornerup\nAllerslev,"11.3533483101,54.7681042483\n9.80491708262,56.5093821893\n9.01119022559,56.4929783393\n9.98860732712,56.8972536846\n9.85153350048,55.8551660724\n10.6584180146,55.4698770187\n11.3875731915,55.651792334\n11.3679861243,55.1982157372\n10.2899515737,55.4528008246\n8.56856581953,55.2736102362\n10.0519110667,55.46645491\n10.1088629687,56.5813365205\n9.14648465883,56.5742352068\n10.3419121098,55.0929016765\n8.91416116186,55.4817359846\n8.79312421701,56.2588792995\n10.2967808378,57.253736737\n11.565356167,55.416388795\n10.5966462019,55.8285318479\n11.5155164705,55.5668630724\n12.5232797256,55.6804588197\n9.74719475563,56.5032738976\n9.2229505881,55.8408919456\n10.0473406515,56.6761094867\n12.0360433992,55.8748310761\n8.57817548367,56.4319505845\n11.9832770222,55.6338388327\n12.0354819111,55.081565407\n8.37383411954,55.7211801523\n11.9642879487,55.5985197936",40.85358333333338
http://www2.statsbiblioteket.dk/mediestream/avis/record/doms_aviser_page%3Auuid%3A797c179a-01c2-45f0-992f-8b02c6124aad,doms_newspaperCollection:uuid:797c179a-01c2-45f0-992f-8b02c6124aad-segment_3,1862-03-01T01:00:00Z,51.4,0.486,"Fnteresse. om den vctkommende Personlighed kunde blire sat istand til paa denne Maade at saae sin indinlontfle Gjald oflost af en udenlandsk, staoc dog Sagerne endnu saaledeS forelobig ben. ilet Finansministeren ikke stal vare at formaae til at give det ovenfor omtalte Bcviis. (Ah. A.) Hel sin g or, den Lkde Febr. Det ene af de her i Byen Torstag Aften den 30te Januar begaactc Tyverier, nemlig i Ejendommen Nr. 14 1 i Broslratct af 599 RV.. er i disse Tage blevet opdaget ved et rccnt Tilfalde, linder et kort Opbolr i Kjobenhavn modle nemlig den Bcstjaalnes Kone reb Jnbaangen til et Eondllori en ung Pige. ter tidligere barde opholdt fig i samme Huns, hvor Tyveriet var bcgaaet, men for tort Tit siden var reist til Kjobenhavn ; red Synet as hendes Dragt i Forening med andre On stantighctcr saltede hun Mistanke til hente og blev endnu mere bestyrket i denne reb de i Eonditorict indhentede Oplosninger, hvorpå a hun anmeldte Sagen paa Politikammeret i Kjolen- havn. E fikrat den unge Pige os lette var bragt tilstede og forhor«, tilstod hun Tyrenet og blev tcrpaa bragt dertil, bror hun nn firdcr arresteret. Den storstc Deel af Pengene var« sal overstyr til )»d!job af forssjellige Gjenstande, navnlig af et Fortepiano. (Byens Av.) Tel srrste offentlige Mode asEcmmuiialbesty- reisen i Middelfart afholdt. s i Levcrdags c'- ter forudgaact Bckjcnttgjorelse paa den som „osfi- ciel"" hetegiikte P aatc, »enilig red — Trvrnnicsiag. — Ved Motet i Lovcrtags vare samtlige Med- lemmer tilstede. Efter r» Indledning af Byfog- len, der gav Borgcrrcprasctitationcns Formand Anledning til rnteel Modbcmcrikninger, fremsat- tes bl. A. Frrflog em at eonstitncre sig under Altersfoimandkn for at valgc c» Fornionl. Med 9 Stemmer imod 2 bcsinitctes let, at Forsiagct fluide nyde Fremme. Da imidlertid Bpfogden maatte bctraglc sig som sott Formand i Eoni- »»nalbcsiyrelsen, blev Valget standset eg Sagen ril i Henbold til LovenS 5 2 blive overgivet til Ministeriets Afgjorelse. (Mtf. Av.) Ten 19de Febr. dote paa Augustenborg Prcrsteenken Ehristiane Birgitte Bering fodt Sa- bro. i en Alter af 87 Aar. Hentes Fader kode i ung Alter som rlsidcrcnte Eapcllan ved Tom- kirken i Viborg, og hun blev opdragen bos Bed- stcfater.n, Prastcn Monrad i Ltuin ret Aarhuus. Hendes Mand var Sogncprast i Nimtofte. Aar- b»»s Stift, men dodc allrrctc i MarlS 1799. efterladende hende fem Enke i en Alter af 24 Aar ineb en E r» og en Datter, der fotteS efter hans Ted. H»» har saaledeS verret Enke i 63 Aar red samme Sognekald cg modtaget Pension af 9 Prerstcr, hrat der vist vil vare ,t sjeklent Zilsalte. Hun nedstammer i 8te Led fra Prersten Jacob Monrad red Goslar. der var gift med en Cyster til Luller cller maosicc til hans Hustru Cathrine Bora, og medunderflrev den Augsburgffe Confcssion. Benarnte Lntl ers Svoger har bavt fiere Efterkomniere, der vare Prerstcr paa Als i forstjclltge Sogne. (D. d. El.) I en Landsby i None Tilbmaiflen i Holsten cpficd for kort Tid siden on Tratte imellem et Par LEglcfclk. der tilhorer Arbejderstanden. Da Manden begyndte at blive baandg, idelig, und- slap ter Konen de Ord: Hor Du maaflee ifinde at myrde mig. ligesom Du har mordet Postkarlen? Paa Grund af denne mistankclige Mlring, der bortes os endeel Folk, som Trallen havde hidlokkct. blev Manden arresteret og taget i For- hor as Laiidscgtcn i Heide. Han skal nu have afgivet ten Bckjcndelse, at han er Ophavsman« ten til let afflyclige Mord, som for c. 24 Aar siden blev »toret paa en Prstkutfl i Echnellmark Skrv, paa Landevejen imellem Kiel og Egern- fjord, ved hvilken Lciligbcd ter tillige blev fra- roret Posten en betydelig Cnni dccls private, decls offentlige Penge.",doms_aviser_page:uuid:797c179a-01c2-45f0-992f-8b02c6124aad,doms_aviser_edition:uuid:fc385aec-8076-4f59-9b62-6af7af44edb7,doms_aviser_title:uuid:7f6084e3-521f-433b-8451-73a897cdc053,viborgstiftstidende 1862-03-01 001,viborgstiftstidende,2,1,Viborg,Viborg\nBering\nMiddelfart\nAls\nNimtofte\nLed\nEjendommen\nAugustenborg\nGrund\nByen,"9.40176695552,56.4443347362\n10.0581430741,56.0977454289\n9.74486903146,55.4994582561\n10.2878863997,56.7555351681\n10.5662073626,56.4106433792\n8.20685951417,56.2734476981\n11.9076041384,55.4842962937\n9.88191988185,54.9510659632\n10.2931522694,56.4651947577\n9.757801692,55.699493073\n8.39276925385,55.4329764527",10.439956349206362
http://www2.statsbiblioteket.dk/mediestream/avis/record/doms_aviser_page%3Auuid%3A01606295-d0b3-4947-a37d-4cfc70f6b95c,doms_newspaperCollection:uuid:01606295-d0b3-4947-a37d-4cfc70f6b95c-segment_1,1862-03-06T01:00:00Z,53.5,0.465,"teist niærfoærdigt Stemme ni ed alle Forandrii!- Aer i Fæliesforf. maa forklares ak, at ban son, sekt Holstener derved kunde blive ..mulig"" til boicre Poster i Holsten! kJ sin Tid valgtes han til Rigsraad af len siesvigjkc Stæntcrfs. ved en Over een skomst mclleni det tytffe Fleertal og det danske Mindretal.) (Est. Dvk.) Det bar glædeligt overraflet os i „Flvp."" for lste Marts — samtidigt nird Efterretningen oi», at den bekjendte G r line, som udentvivl i ten senere Tid bar redigeret Bladets ledende Slrtik- ler i sin gamle mod det »uv. Ministerium fjendtlige Slant, har begyndt et eget Blad „Kro: en"" (j: om Kongeregimentet „af Guds Naade"") — at sinde en ledende Slrtikel af en gammel Medarbejder „b ."" (Prof. P. Hjort?). I. ns Ind- bold re følgende : Det er virkelig komisk eller, om man vil, skammeligt, naar Preussen og L'fier- rig nu spørge og sporge, hvad Kongen af Ian- mark vil gjore for at opfylde „Løs.eine"" fra 1851 og 52, og protestere mod Rigsraadcts Lovlighed for Danmark og Slesvig, efterat den med Forbundets Samtykke (eller rettere efter dets tvingende Beslutning) er opber- vet for Holsten-L. Te faakaldte „Lofter"" fra No keverlen 1851 «re fnldsterntigt op- syld te ved den kgl. Knndg. af 28de Januar 1852. hvilket Forbundet selv har erkjentt vet sin Besi. af 2vde Juli 1852. Ter kan altsaa kun vcrre Tale cm „Lofterne"" i ten kgl. Kuntg.; ja. det er meget tvivlsomt, om tens Bebudelse af e» Fallossers, er et „Løfte"", da det i ten preussiske Nole af 50te Teebr. 1851 hedder: „Te tyd ske Magter erkjente, at en Re- præsentation af alle Monarebiets Tele i en lov- girende Forsamling ikke er uforenelig med Holsten - Lauenborgs særskilte Rettigheder""; thi denne Udtalelse indrømmer kun en Fcrllrsfor-- fatnings Mulighed eller Tilst edelig hed, men indeholder flet ikke en Modtagelse af noget Løfte af Danmark, som ubetinget stnltc opfyldes ved tens Indførelse. Hvad nu „Lofterne"" i Kunkg. angaacr, da er den „lovede"" Falles for- valtning strar traadt i Kraft den 28de Jan. 1852 og destaacr den Dag i Tag. Tet an- det „Løfte"" omen falles Forfatning har Hs. Maj., som bekjendl, vel hidtil ikke kunnet en- delig opfylde, men gjort flere alvorlige For- fog paa at opfylde, og disse Forsøg ere kun strandede paa Holstenernes egen Modstand i Rigsraatct og Etdfs. og Tydstlants, isar Prens- fens, Lpmuntung til og Understøttelse as denne Modstand. Som bekjenlt gjor Hs. Maj. forti- den et »yt Forsøg paa at ordne en Forfatnings- form for Falles- Lovgiv »ingen ved al lade Fa ll csfo r f. af 1855 b est a a e for Danmark og Slesvig og underhandle med Pr.-Lsterrig om en Ordning af H o l st en-Laucnborgs Med- virkning i Falles lovgivningen. Slt Pr.« nu dencgte Rigsraadcts retlige Bcstaarn for Danmark og Slesvig, fordi Forbundet har tvunget Danmark til at ophave Fallcsforf. for Hølstcn-L. er ligesaa urimeligt, som om del stolte T yd skla n t havde anseet sig for ophavet, da det i sin Tid mistete Schweiz, Elsast, Lotbrin- gen, Burgund. eller som em Lerd Raglan, Eng- lands Cbef paa Krim, ikke af SKU betragtedes som en fu l d st a n d i g engelsk General, fordi han ved Waterloo havde mistet en Slim. Bel er dette Monarchiets Rigsraad fortiden et „R c st- rigsraad"", men t y d sk e Noter formaae dog ikke at spotte det sonder eller skrive tet ibj.l. Pr.-5Z. spørge: „Hvad vil Kongen gjøre ror at opfylde det Løfte, han 1852 gav sig selv og sit Folk?"" Han vil netop gjøre det, som han uafladelig gjor og som jo netop Tydskland stadig deeltager i at gjøre, nemlig arbejde paa at finde en Ordning, som hans uvenlige og neppe ret årlige tydske „Medforbnndne"" endelig engang ville gaae ind paa. Ten nyeste Frugt af denne RegjeringenS Bestræbelse daterer sig allerede sia 27de",doms_aviser_page:uuid:01606295-d0b3-4947-a37d-4cfc70f6b95c,doms_aviser_edition:uuid:66a200ef-4590-4e58-9563-62fb60c6ea14,doms_aviser_title:uuid:7f6084e3-521f-433b-8451-73a897cdc053,viborgstiftstidende 1862-03-06 001,viborgstiftstidende,2,1,Viborg,Slesvig\nTilst\nNo\nFalle\nLauenborg,"10.0473406515,56.6761094867\n10.1133202197,56.1903667694\n8.31789315769,56.1120215288\n9.24692960763,56.3899885961\n11.3619501679,55.52926548",30.388714285714297
http://www2.statsbiblioteket.dk/mediestream/avis/record/doms_aviser_page%3Auuid%3A19854fe3-4232-4b56-b2fc-282c7c72219b,doms_newspaperCollection:uuid:19854fe3-4232-4b56-b2fc-282c7c72219b-segment_1,1862-03-06T01:00:00Z,50.2,0.498,"Molbohistorier.\nEt Ercmplar af de bckjentte M o l b o l? i ft o- rier, udtommen 1820 eller tidligere, onsscs til- kjobs af Bogbandler ??. Olsen i Viborg. Dampskibet „Ydun""\nvil, saafrcmi \\ interen tillader det, aføaae fraKjo- benhavn til li ånders Loverdagen den 1 5de Marts, Eftermiddag Ml. 5, fra Banders til Kjø- benhavn Tirsdagen den ISde Marts, Eftermiddag Kl. 3, o% atter fra K j o b e n li a v n Løvcrdacn den 22de o i? fra Kanders Tirsdagen den 25de Marts, hvorefter Dampskibene ,,Ydun"" 05 Banders' paabegynder deres regelmæssige Kaiter som forrigo Aar, Leverdagen den 29de Marts, hvilket nxrmerc- vil blive bekjendtyjorf.\nBrødrene Petersen.\nSkudtorv at modtage i Skanngaards Mose fra 2 Rd. pr. Lers til hoierr Priser erholdes hos linder- tegnede. Bestillinger paa Torv at levere i Vi- borg modtager Hr. Eonsul Jensen. Skaungaard, ten I.-de Januar >862. A. Spendrnp. HafmiuDefit fedt 5ludeKjod faaes forstkommende Lvverdag vaa Viborg Torv boS I. Zenfen »ra Skire.\nHalle. C. Graff 9.\nTonrcr. Arbejdsmand Johann Begier . . Ringsted. Forvalter Aarup — Svenstrup ! . - Breve, der paa Grund ai Mangelfuld Adresse, ci kan anbringes: Frederik Johansen i Binkclstrcde. Ungkarl Christian Pedersen i Obroe. Jens Rasmussens Enke paa Lillevnstruphede. Mad. Mathilde Strunk — Fredensgade. Ticnestckarl Carl O- Pedersen - Orrcp. Martin Pedersen i Knud. Arbeidsmand Mikkel Reisen. Viborg Postcontoir, den iste Marts 1862.\nL. M. Hsfgaard. Nye sode Alessina Abildsincr\nfaaes bos Jen« Preisler.\nHuus til Zalg.\nFormedelst anren Besiemmelsc agter Undertegnede at sirlge mit paa Tange Mark cicurc Huns, sotii be- st.iaer as 11 Fag god Bindingsveerk. ftaacnde for 3rp. Hartkorn , 20 Tondcr Land Skovjerd. Af Vintersæd cr der nedlagt !2 Skpr. Rug: Totveskiacr eg Mergel haves 1 Overflod ighcd. Prisen paa r.crvnte Ciendom vil blive billig, »aar Handel kan stee snart ated C. Jensen i Hoiberghui'e. Ar der Onsdagen ren 2«rc d. M., Formiddag Kl. II, vil blive asheldi Skiftesamlinger i Kiclleru? Kro i L»»»>. ,!ue'» Niels Clandins Peterfens\ns Redigeret, trykt og udgivet af H. Wissing.)",doms_aviser_page:uuid:19854fe3-4232-4b56-b2fc-282c7c72219b,doms_aviser_edition:uuid:66a200ef-4590-4e58-9563-62fb60c6ea14,doms_aviser_title:uuid:7f6084e3-521f-433b-8451-73a897cdc053,viborgstiftstidende 1862-03-06 001,viborgstiftstidende,4,1,Viborg,Mose\nSvenstrup\nTange\nViborg\nRingsted\nHalle\nAarup\nGrund,"11.709470024,55.7678578511\n10.5609236195,56.4090656126\n11.1753519423,55.3622095429\n10.7077041216,56.3555073462\n9.51460213463,56.837433089\n11.0968199283,55.7260144775\n9.21066542082,56.9284939513\n9.7759099434,55.4808083086\n9.94123269725,56.602555992\n8.83027722652,56.4678597065\n9.83307048146,56.9694504383\n10.340616234,55.3361839735\n11.7681605911,55.1720123816\n9.81607766183,56.2418693989\n9.1382137677,56.5913593907\n9.82977825785,55.0288269305\n8.65616706291,56.2903711734\n10.4444733341,55.1588720494\n10.7591114356,55.1416153245\n8.55493929503,55.6551715565\n8.79911358321,55.3260024418\n8.82176238537,55.4487125709\n10.657304511,55.3708898339\n9.58254013542,56.3526405073\n8.55213253698,55.4650600771\n10.1434219482,57.4313069438\n9.40176695552,56.4443347362\n11.7865717336,55.4380297704\n11.7981254442,55.4446609467\n9.50144644392,55.9838623852\n10.0495997209,55.3758296132\n10.2931522694,56.4651947577\n9.757801692,55.699493073",19.342833333333314
