link,recordID,timestamp,pwa,cer,fulltext_org,pageUUID,editionUUID,titleUUID,editionId,familyId,newspaper_page,newspaper_edition,lplace,location_name,location_coordinates,sentiment
http://www2.statsbiblioteket.dk/mediestream/avis/record/doms_aviser_page%3Auuid%3A7281737d-11d0-4fa1-a40d-57c1decaa38a,doms_newspaperCollection:uuid:7281737d-11d0-4fa1-a40d-57c1decaa38a-segment_5,1862-04-10T01:00:00Z,51.8,0.482,"ncppe hor varet af den Beskaffenhed, at deu .har tynget i han« Lomme. Han gik nemlig op til en af vore storre S kræder? og bad ham. da han samme Tag fluide i Selskab og ikke gjerne vilde kjobe en civil Dragt, i den Anledning at leie sig en saadan ; ban skulde benytte den strar, og S kræ- dertn kunde jo beholde Uniformen som Silkerhev. Ten godtrrentc Skrat« indvilgede, og ten unge Mand offerte sig strar Uniformen og iforte sig len civile Dragh hvori han gik bort og ikke har ladet sig sce siden. (Rt. Av.j „Maaiielsrosen"" er Navnet paa en besynderlig literair-industri l Forretning. Det er et Hefte- flrift, som udgives i Berlin, men som med det samme Indhold og med Anvendelse af te samme Lithograpbier og Trasnit. ndkonimer samtidig paaTanfl og Svenfl. Tydfl, De'nssifl og Ungarfl. og afsattes eller som anden Pare „forsendes"" ved reisende literen« Proveryttere. Da det er overordentligt billigt og ter snakkes godt for Da- rerne, har det vundet c» stor Udbredelse, saa det alene her i Landet flal tælle henved 70<0 Abon- nenter. Firmaet, som driver denne Forretning, gjor derfor gode Asfaircr, og har, hviS te tydfle Blade og „AarhnnS Avis"" ikke fare med Rover- historier, et javnt lille Li ver skud af over 20,000 Rd. Den tidligere Nedactenr aflen kjobcnhaviifle .Nybedsoost"", Mathias Meyer — Son as den bckjendte Edvard Meyer — har i denne Anled- ning forladt sitFatrelaud sor i Berlin at „gjore"" i „Maanedsroser"". (Abpst.) (Her i Viborg gjor en Agent i denne Til Forretning i „MaanetSrosen"".) Arbejderne paa den fvenfle Jernbane ville den lire April blive paabegyndte paa hele Linien. Maleri af den svenske Konge. Kong Earl bar tilstillet det kongelige Academi for le fljonne Kunster i Kjobenhavn et Maleri, malet af ham selv: Bradagerbackcn paa Beien mellem Christiania og Trondhjem, og foræret det til Akademiet. Det sccs for Tiden i Kunstudstil lingen. (Vdb. Av.) stkormanden L. Diktrich>on, Doccnt i Upsala og her i Landet bekjendt ved sin Indledning til len danfle Literaturs Studium, holdt i Tirsdags fjorten Tage i Christian ia for en overordentlig talrig Tilbercrkrcds et Foredrag over ten nys aftodc Digter Bernhard Severin Ingemann. Han (kildrede den nærmest foranliggende Tid med sine Omvcrltningcr i ten politiske Verden og det dermed svigende Fritænkeri; Ingeman er netop fort i Revolutionsaaret 1789 — satte som lit Hovedmaal at gjenopbygge, hvad hine Tider bavle nedrevet. Fædttlantskjærlighkteii og Ehristkntroen. Hans Birken i tisse to Retninger var let især. Taleren vilde paapege. Han gjeiuiemgik derfor ten hele Række af Ingemanns historiske Roma- ner, talte cm deres store Udbredelse hos den danfle Almue, (hver Bonde i Danmark har tre Boger paa sin Hylde. Bibelen, Saro Grammaticus og Ingemanns bistorifle Romaner"") og paavistc hvor meget de have virket til at styrke Fædrelandskjær ligheden og Nationalaanden bos de Danfle. Navnlig folies tisse Romaners Indflydelse dybt. da Krigen med Tydfleriie, ganske lig den i tisse Boger skildrede, brod ud i 18-18. Ved nltrin- gen as Ingemanns Psalmedigtning oplæste Ta leren nogle af hans bedste Digte. Endelig gik ban over »il at fortælle om Digterens personlig. Forhold og om den Paafljonnclse, der især i hans senere Aar blev ham tildeel fra hans olks Sire. Man har i Kjobenhavn i disse Dage oplevet det heldigviis sjelrne Tilfælde at sce en Officicrs- Aspirant efterlyst i Bladene som Tesertenr. Den unge Mand — som der siges et notorifl daarligt Subjekt — iværksatte sin Flugt paa en eien- dommclig Maade, og maa sagtens have havt meget Hastværk, silen han ikke ventede til Dagen efter, da det var Gagedag, og hans Pengepung ..Nogle Hanaucre"" (KnrheSsere) have ten 2de» April 1862 tilsendt Hamborgerne Schuirmann og Thaulow solgente Skrivelse: „Vi bede Dem. hoiilæredc Herrer! at lægge med- solgente KrandS raa ten flcsvigholftenstc Major C. Inngmanns Grav »il Erindring om ten 5t» April ""l k 4 og ten nu Afrote paa hans Hædersdag. Ti!« lig? bete vi Dem om at anvende medsolgende Belob til at stifte en Præmie, som til Minde om Scier- herrerne ved Eckern sorte aarlig den 5te April skal uddeles til en Lærling i DereS S o mand -skole. Gid De endnu maae opleve den Tid, da det. De stræbte og endnu stræde efter, opfyldes, da en tydst Flaade stolt, som re ovrige, gjenneinkrxdser Havene og Lærlinge af DereS Skole fare som dygtige Somænd un> der det sortrodgyldne Flag"". Naturligviis vil — tilsoicr „H. Bsh."" — det indgaaede Bclod med Tak blive anvendt i det angivne Oiemed. Alvocat B argnm s Udnævnelse til Borger- mester synes at have bragt det fleSvigbolstenfle Parti i Kiel aldeles ud af Eoncepterne. Til „Hamb. Nachr."" ssriver saaledes bl. A. : „Ophid- selscn tiltager stadig. Teputeretcollegiet bar gjen- tagne Gange boldt Meter, ogsaa Borgerne for- samlede sig flere Gange i stor« og mindre Kredse, og iaften (den 5te) var der baade en Forsamling af Bvcollegierne og en af 3—100 Personer be- sogt Forsamling af Borge« og Indvaane« i Byen. Som man horer, har Teputeretcollegiet fattet den Beflutning at andrage paa Sammen- kaldelsen af et „Borgerflab"", for at dette kan an- drage bos Hs. Maj. Kongen paa, at Arvocat Bargnms Udnævnelse atter maa blive ophævet. Denne Beflutning flal være motiveret ved, at Hr. Bargnm ikke besidder Borgerflabets Agtelse og Tillid. Localstatutet for Kiel foreflriver nem- lig, at Bycollegierne ikke selv tor foranstalte no- gen Forsamling af Borgerflabet, men at en saa- dan knn i særteles vigtige og overordentlige Til- fcrlde tsr sammenkaldes efter sVrudgaaet indhentet Tilladelse fra Ministeren. Teputeretcollegiet vil nu, at en saadan Tilladelse flal soges indhentet. I den omtrent samtidig afholdte Forsamling af Borgere og Intvaancre blev der ogsaa fattet en Resolution, som ligeledes erklærer, at den nynd- nævnte Borgermester ikke besidder Fottamlingens Agtelse og Tillid. — Det var naturligviis at forudse?, at det flesvigholstenfle Parti vilde blive",doms_aviser_page:uuid:7281737d-11d0-4fa1-a40d-57c1decaa38a,doms_aviser_edition:uuid:e245d0e3-5796-4b28-995f-f2b12b284533,doms_aviser_title:uuid:7f6084e3-521f-433b-8451-73a897cdc053,viborgstiftstidende 1862-04-10 001,viborgstiftstidende,2,1,Viborg,Viborg\nBirken\nBorge\nTaleren\nBerlin\nChristiania\nLinien\nMinde\nByen,"9.40176695552,56.4443347362\n9.83157209692,56.1631114896\n9.39815889458,56.8229096003\n8.60259291961,55.4738606554\n12.5409803237,54.9882939866\n10.0519110667,55.46645491\n12.6064719593,55.6767543709\n10.1303432237,55.2425128106\n9.61918937877,54.8988033895\n8.39276925385,55.4329764527",93.92872222222218
http://www2.statsbiblioteket.dk/mediestream/avis/record/doms_aviser_page%3Auuid%3A762818f1-a5fc-4da4-b7f9-ce6103daf8de,doms_newspaperCollection:uuid:762818f1-a5fc-4da4-b7f9-ce6103daf8de-segment_3,1862-04-14T01:00:00Z,53.9,0.461,"Adresse-Avis.\nMandagen den !4de ZXpril 18G2.\nsig i interessante Omstændigheder. Men ogsaa den sranste Kroiiprcrtendcnt Greven af Ebambords („Henri V's"" Gemalinde Theresa af Modena, med hvem hans LEgtestab hidtil — i 22 Aar! — har vcrret barn lost, stal vcrre i samme Omstændigheder. Dermed er alt Haab ude om en „Fusion"" set Thronforlig) imellem den crlbre og ten yngre torleansste) boiirbonstc Linie, som hid- til kun er strandet paa Hert. af Orleans's Enkes og Sons Vcrgring. Italien. Det kgl. Tccrct. som oploser Frivistigeorpscrne (Garibaldis „Sydhcrr"") indlemmer de af deres nuv. 3400 Officiner, som have faaet kgl. Be- lrcrftelse, med deres nuv. Rang i den italienste Armce og overlader de Menige enten at afstedi- ges med 4 Aars Sold eller at trcrde over i Li- nien. — Garibaldis Skytteforeninger udbrede sig over hele Italien. Ten 5te bed det i Turin, at Osterrig truede med Krig, ifald den italienste Re gjcring ikke gjorde en Ende paa Garibaldis De monstrationer. Ten italienste Gejstligheds saa stcrrkt tiltagende Frafald fra den „verdslige"" Pave turde virke Mere paa den pavelige Regjering, end Frankrigs Tryk. Spanien. Madrid, den 9de. Regjeringen har i Cor- tes erklæret, at den billiger Gen. Prims Over- eenskomst med den mcricanste Prcrs. Juarez (som Frankrig har forkastet). Belgien. Brus se l, den 9de. Eoopmans Forstag, at suspendere Fcrstn in g s arbejderne i Antwerpen lpaa Grund af „Monitor"" -Historien) forkastedes idag af 2det Kamnier med 63 mod 20 St. Dsterrig. Ter er nedsat en Eommission, bcstaaende as begge Krigsministre, nogle hoie Generaler og de to Admiraler Dahlerup og Wissiak, om det bedste Kystforsvar for Lstcrrig. Ten er allerede bleven enig om, at et tilstrækkeligt Forsvar ku n er muligt ved en Flaate, ter' er den itali- c nste vorcn, og tilraatcr Bygning af Pantser- kibe. Allerede ere to saadannc færdige til at stikke i Soen og 3 ere under Bygning paa Krigs- vcrrfterne. Rigsraatet er hoist utilfreds med, at en Ildgift i 40 Aar af 60 Milt. Rd., endnu ikke yder Osterrigs Kyster et „tilstrækkeligt"" Forsvar. Dets Finantsndvalg foreflaaer Bevilgelscn af l0 Biill. Rd., deraf 5- til 3 Pantserstibc og 2 Scilfregatters Forandring til Skruestibe. — Den italienste Bevægelse i det italienste Syd-Tvrol griber stærkt om sig. Preussen. Berlin, den l0te. JntendantursecretairKoh- ler har aflagt en udforlig Tilstaaelse om bc-",doms_aviser_page:uuid:762818f1-a5fc-4da4-b7f9-ce6103daf8de,doms_aviser_edition:uuid:2a9b5cf6-a0fd-41e8-aad8-1ea77b7b2bf8,doms_aviser_title:uuid:7f6084e3-521f-433b-8451-73a897cdc053,viborgstiftstidende 1862-04-14 001,viborgstiftstidende,1,1,Viborg,Frankrig\nSpanien\nBerlin\nKrig\nGrund\nAars,"10.3426132261,56.3014420551\n9.68804668151,56.0925269907\n9.19733549203,55.0167306803\n10.0519110667,55.46645491\n9.26238627273,54.8907965043\n10.2931522694,56.4651947577\n9.757801692,55.699493073\n9.51368182691,56.8025344518",13.406444444444459
http://www2.statsbiblioteket.dk/mediestream/avis/record/doms_aviser_page%3Auuid%3A46852816-985f-4894-a015-15955539b559,doms_newspaperCollection:uuid:46852816-985f-4894-a015-15955539b559-segment_3,1862-04-17T01:00:00Z,55,0.45,"mann Marie Hinke og hun er fadt i Kjerteminde 9de Juni 1819 af polfle Forældre. I VinterenS Lob havde Sognepræsten forberedt bente til Daa- ben. .Festen var faameget glædeligere, som bun uden noget andet Hensyn gik ind i Menigheden med et troende Hjertes Længsel. Hentes Fader plciede, da hun var Barn, om Aftenen at ned« bete Abraham?, JsakS og Jacobs Velsignelse over hende; nu troede hnn, at hun bavde faact denne Velsignelse. En talrig Menighedskreds havde samlet sig om denne Daab, der ved GutsNaade vil blive til Velsignelse for bele Mcnncfl, heden og ikke mindst for det Huns, hvori den trofaste kristnede Huusmodcr ved sin gode Bekjendclsc og stille kristelige Vandel vil aflægge et levende Vid- nesbyrt for sin Mand og deres 0 Born, ter alle bore til Menigheden. Hun var ten 23de MartS med sin Mand, sin ældste Datter og en Deel af sine nærmeste Daabsvitner Gjæst ved Herrens Bord."" En nv Industrigreen synes at ville aabne ng Indgang paa Als, nemlig at terre Fifl. Fifleriet har stedse været drevet omkring O>n, men Fiflen er hovedsagelig bleren jolgt fersk, og en Folge deraf var, at man ikke fiflede niere, end ter paa benne Maade kunde afsættes. I te se- »>re Aar har især Kjobmant Andr. Karberg i Sentcrborg ovkjobt Torfl af Fiflcrne til Tilvirk- ning af Torfifl (Klipfiff) og det i et temmeligt Omfang, omtrent 100,000 Pt. opfljaarcn og af- nakket Torfl varligt. Jævnsides ved Fiffetorrin- gen vindes Tran og Vognsmorclse af Torfleleve- ren. Den bedste Levcrtran er saa klar og fiin, al den iffe staaer tilbage for ten, der falbydes paa Apotbekerne, og afsættes ogsaa »middelbart til dem, ter bruge ten som Lægemiddel. Vogn- smorelsen har Fasthed som gron Sæbe og sæl- gcS for 0 Sk. pr. Pd. Iaar har man ogsaa ved Ocns Ostkvst fanget megen Torfl. og flere i Nærheden af Stranden boende Mænd bave es- terlignet Karbergs Ercmpcl og ovkjobt Fiffen for at fabrikere Klipfiff af den. Prisen bar været 1 Sk. pr. Pund og Fisserne have derved havt en god Fortjeneste. Man har isind, ved Stran- den at bygge egne Huse. hvor den nyfangede Fifl kan modtages og behandles. Den meste Torfl pilkes, men nogen fanges ogsaa paa Kroge. Man har fanget Torfl af over 30 Punds Vægt, ja endog l. der vejede 40Pnnd, tog mener man ikke, al det er den egentlige Kabliau. Foruden den store Mængde Torfl. der af Opkjoberne for- vandlcs til Klipsifl og som saadan gaacr i Han- delen, bave Beboerne langS Stranden til eget Forbrug saltet og torpet en betydelig Deel. ter vil afgive et vigtigt Næringsmiddel for Arbejder- befolkningen. (Ugefl. f. Ltm.) Stænderteputerct. Stadshauptmand og Raad- mand i So nd erborg H. P. Hansen er i Man- dags Nat afgaaet ved Doden. Ten Aftore »od i sin Eommune almindelig Velvillie og Agtelse for sin aabne. elskværdige Eharacteer og sit varme patriotifle Sindelag. Han har. saavitt vi min- des, repræsenteret Sonderborg i ten fleSvigfle Stænderforsamling lige siden denne Institutions Gjenoprettelse efter Oproret. (Tvk.) Om Conferentsraad Kirchhoff flrires fra Rendsborg til .Flop."": 1844 var han tilligemed Pastor Man de eneste Stteputcicde i Itzchoe, ter bleve siddende, medens de ovrige oploste jig og rciste hjem. Det var hans Livs loyale Taad, formedelst hvilken Rcventlow-Criminil i sin For- legcnhed 1851 forfremmede ham fra Underrets, advocat til Borgemestcr i Kiel. Hans Uduelig- hed til denne Post var ikke „weltkundig"", men fuldkommen „Holsten kundig"": Regjcringcn har der- for sikkert meget længe havt ham paa Afgangs- listen. For sin Eftergivenheds Skyld var han nu valgt til Formand for „Univerjltets-Comiteen"". Etsr. Overappellationsraad Malmros, som ind- saae, at Eomiteen kunde trænge til et Flag at ferle under, foreslog, at man fluide bede HS.",doms_aviser_page:uuid:46852816-985f-4894-a015-15955539b559,doms_aviser_edition:uuid:b77ebea3-66c2-4e1f-ac46-32c71a670fc0,doms_aviser_title:uuid:7f6084e3-521f-433b-8451-73a897cdc053,viborgstiftstidende 1862-04-17 001,viborgstiftstidende,2,1,Viborg,Kroge\nStranden\nAls\nRendsborg\nVandel,"8.83104603194,55.8465397618\n10.0876352332,57.0546694361\n10.2878863997,56.7555351681\n9.49728260225,55.8153435255\n9.2162762294,55.7085414172",48.675000000000026
http://www2.statsbiblioteket.dk/mediestream/avis/record/doms_aviser_page%3Auuid%3Afa7f8ea7-d855-4cdb-878b-f0e444418b96,doms_newspaperCollection:uuid:fa7f8ea7-d855-4cdb-878b-f0e444418b96-segment_6,1862-04-22T01:00:00Z,50.1,0.499,"Suur phosphorjuur Kalk.\nBestillinger paa fimr pbosphorsuur Kalk, fra Norrebroes Gjodningsfabrik ved Kjobenhavn. mol- tages af Undertegnede . hcs hvem samme kan erholdes i Lobet af 8te Tage efter at Ordre er indsendt. N. P. Holmgaard.\nViborg, den 7de April 1862.\nIerubanearbeide. 2 «pand arbeitsstoerkc Heste med 3 Arbcils- vogne kan faae daglig Kjorsel paa Linien. Accord trcrffcs med Kjobmand Georg Preis - ler i Viborg. Tet til Stiflslandinspecteur Foss's Gaard borende Stykke Haugejord er strar at faae tillcie. Adressecontoirct anviser af bvem.\nGocle TSNvseciovikker\nfaaes hos Jens Preisler. Et mindre Parti gode Scrtte-Kartoflcr (tidligmodnc) er indsat til Salg bos A. E. K j ae r. Torveskjcrrerc og Strygere kan faae Arbejde i Katmost. G. Boye. Hintbrrrplanter,\nrode og hvide blandede, 8 Mk. pr. loaStkr., >6Rd. pr. 1,666 Slkr., faaes hos H. D. Knutzen.",doms_aviser_page:uuid:fa7f8ea7-d855-4cdb-878b-f0e444418b96,doms_aviser_edition:uuid:a520381b-f7a6-44d7-b93e-770ad5a99b81,doms_aviser_title:uuid:7f6084e3-521f-433b-8451-73a897cdc053,viborgstiftstidende 1862-04-22 001,viborgstiftstidende,4,1,Viborg,Linien\nViborg,"10.1303432237,55.2425128106\n9.40176695552,56.4443347362",6.388888888888885
http://www2.statsbiblioteket.dk/mediestream/avis/record/doms_aviser_page%3Auuid%3A0958a906-de07-48c1-97f2-5ec5aec0cdb5,doms_newspaperCollection:uuid:0958a906-de07-48c1-97f2-5ec5aec0cdb5-segment_2,1862-05-07T01:00:00Z,54.1,0.459,"at befrygt,, at en MiSgjerning er begaact, og at den Paagjældende, efter at vare brorbt, tt kastet i Vantet. (Byens Av.) En deist beklagelig Faarccvedenii bar i loen« gere Tid grasseret i Omegnen ok H jer ri »g, navnlig i te vestligere Sogne, i hvilke der kun fintes faa Steter, hvor Eierne ikke dave mistet et eller fiere Faar. Hos te fleste af Faarene vttrer Sygdommen sig ved store „Poser"" unter Halsen, lllten salter af dem og naar man flag ter Tyrene, fintes betydelige Vantansamlinger rundt om i deres Indre, og Skindene ere næstrn usælgelige. (Ab. Av.) Aalborg, ten (ile Mai. En sorgelig Ve- givenbed er indtruffen paa „Dania""s sidste Neise herfra til Kjodenbavn. itet, som allerede kbbavnffe Blade idag omtale, en Grosserer derfra, der en Rælke af Aar var bekjendt som Eicr af en stor smuk Gaard paa St. Annaplats, den han i Vinter solgte, havde et Stecnsleberictablissemcns samt en Landejendom her i Egnen — pludselig forsvandt i Bolgerne. Tet er ikke Tilfældet, son, et af Bladene navner, at man standsede Skibet, men at der i den alt vundne Fart intet kunde udretteS til at hjcrlpe eller soge den Forsvundne; thi paa Skibet vidste man siet intet herom for i Morgenstunden da ten Ulykkelige savnedes. En Toelsreisende havde vel ved Midnatstid, selv balvt trommende, bemcrrket en aldre Mand, hvis Forsvinden over Ralingcn snart efterfulgtes af en dump Lyd i Vantet, men Taksposiageren bavte intet omtalt for nogen Anden ombord for Morgenen kaldte ham det formeentlige Tromme syn i Erindring. — Ten Forsvundne, c» tid- tigere virksom Mand og med opvakt SandS, men hvis Stilling nok i te senere Aar har va- ret bjcmsogt af flere Ubeld, som tyngede paa Sindet, var nu nar Oldingalteren, c. en 70 Aar, og banS sorgeligc Bortgang kan i alle Henseender kun dybt bekloges cg valke leelta- gendc Stemning. (Aalb. Av.) Efter et til Aalborg i Mandags indlobet Te legram ffntle alle Infanteriets Recruttcr, som vare indkaldte til 30te Mai. forst mode den 2den Juli. (Abpst.) Prints Christian asTanmark, der i denne Tid foretager en Inspectionsruse, indtraf i Sondags Aftes til Ranters. Randers, dot 5te Mai. En afByes virksom- sie og meest anseetc Borgere Hr. Agent H. N. Bay og Frue have idag festligholdt deres Solvbryl- lup under en saa almindelig Decltagelse fra en udstrakt Kreds af Byens og Omegnens Beboere, at vi vel tor tillade os offentlig at omtale denne Familiefest. Fra en stor Teel Venner her i Byen og dens Omegn blev ved en Deputation overrakt Brudeparret et smukt og kostbart Selv- Service, og fra alle Skibene i Havnen vaiede Flag i TagenS Anledning. (Nd. Av.) Gultbryllupsfest. Atter imorgen finter en saatan Fest Sted her i Viborg; Guldbrude- parret er forbenv. Overffjaerer Lund og Hustru?, Begge i deres Alders 72 Aar. Manden har tilvisse varet haardt provet mel mindre glcedelige Tilskikkelser i Livet, senest ved Standsningen af afkode Agent Gultbergs Klædefabrik, hvorved han misted: den Stilling som ban i en Rakke af ikke mindre end henvcd 36 Aar havde havt hos sal. Eultberg. der altid noevnede Lund som en flittig og t> o Arbejder; men ved Siden af disse Provclftr har han vidst at bevare en stor Sjælsstyrke, ter ogsaa gav sig tilkjcnde, da ban paa engang, i sit 70te Aar, mistede en god Stil- ling og dermed Erhverv for sig og hans svage- lige Hustru? : han greb nn til at udfore Daglejer- arbeite, for dog at fortjene Noget, for derved ikke at falde det Offentlige tilbyrde, en Tanke der var ham yderst piinlig ; dog, vi viste baade enffe og haabe, at denne saerdeles respectable Mand med",doms_aviser_page:uuid:0958a906-de07-48c1-97f2-5ec5aec0cdb5,doms_aviser_edition:uuid:66e50fe0-1806-426c-bccf-1bc5f2faf4d5,doms_aviser_title:uuid:7f6084e3-521f-433b-8451-73a897cdc053,viborgstiftstidende 1862-05-07 001,viborgstiftstidende,3,1,Viborg,Viborg\nRanders\nAalborg\nDania\nSindet\nHo\nSkibet\nLund\nByen\nHalsen\nStilling,"9.40176695552,56.4443347362\n10.046555377,56.4573924347\n9.93146311931,57.025292765\n9.91683917278,57.0428743893\n10.0517869904,56.6886593696\n9.1993031089,55.1106797158\n8.2229602027,55.5526707867\n9.45282702499,55.7111498478\n9.56832946,56.5979811936\n9.01733446905,57.1072883932\n10.1882211989,56.4215787195\n9.05108101716,54.9578749722\n8.72753339538,55.7514965432\n10.0047703593,57.3762878597\n9.76685976966,55.8929134847\n12.3014101074,55.2413854707\n8.98410016235,56.5697565282\n9.24078022916,56.6036820747\n10.1909048942,57.4798999721\n10.792793466,56.3541528476\n11.6533343812,55.2797073299\n8.39276925385,55.4329764527\n8.86881638136,56.5220633427\n9.99165592325,56.0615022891",34.900396825396825
http://www2.statsbiblioteket.dk/mediestream/avis/record/doms_aviser_page%3Auuid%3Adcbfca4a-7e95-42c9-8891-40d79d8457ac,doms_newspaperCollection:uuid:dcbfca4a-7e95-42c9-8891-40d79d8457ac-segment_3,1862-05-08T01:00:00Z,53.5,0.465,"sammen paa Malnio Rhed, sor derfra at afgaae til Kjebenhavn. Forlystelserne unter Opholdet her ville hestaae navnlig r en stor Skovftst i Tyrehaveii. en mindre flest i Tivoli, en Festforestilling paa det kgl. Thcater og Udflugter til Helstngor, FredcriDborg, Fredensborg. Iægers- priis osv. (?lb. Av.) Iblandt te Sager, der tiltrak stg meest Op- mærksombed i Kbhavn, da te Gjenstonte, som siulre sorscntes til den store Udstilling i London, begvndte at blive udstillede, var cgsaa en af Malermester Schrøder i Middelfart forfærdiget Buffet. fem endog havde den udmcrrkede 8Ere at blive afbildet i .Illustreret Tidende"", og om hvilken Professorerne Hctsch og Icricl au stolle have udtalt stg sårdeles anrrkjentende. Trods tetle fandt dcu ilke stlaade for tcu ter nedsatte Jntustrindstilliiigs-Eomitees Oi»e, ilet Hr. Kunst- treicr Schwartz „fandt Mangler ved den"", og Resultatet deraf blev, at Buffetten ikke blev an- tagen til Bcsorgelsr til London paa offentlig Bekostning, flor ten Paagjcrldciile, som havde sySlct to Aar med dette Arbejde, var dette »a- turligviis en stem Streg i Regningen; men ban befl rittede stg dog til. for egen Regning og Ri- sico at forsende den til London, i Haab om der at saae ten optagen paa Udstillingen. DctForste har han da ogsaa gjort imod en Udgift af 1 2 Lstrl, men det sidste Haab er glippet for ham, da man der bestemt bar ncrgtet ham Plads i Jndnstripaladset, hvorimod man har henviist ham til en saakaltet „international Bazar"" — en improviseret Bngning, ligeoverfor Jndnstripaladset, for Gjenstante, som ere blevne udelukkede fra dette — , bvor Optagelsen imidlertid kun koster ten Bagatel : 25 Lstrl. Da der folgclig ved denne, som det synes os, noget egenmægtige Fremgaiigsmaade fra Udslrllingscorniteens Side er beredt denne dristige Mand et betydeligt Tab, stolte det gloede os ret meget, om det maatte bekrerfit st , hvad vi her have hort onitale, at Indraar crnr i Middelfart ssnlle bare isindc ved frivillice Sammenstod at holte ban, stadesloS. l?lh. Av.) Til Loiidonnerndstillingen stal, ifolge „Fyens- posten"", en 80-aarig Aftægtcniant, ler boer i Nærbcten af Faaborg, l ave afsendt et Stykke selvlavet Tynevaar, der stal voere noget as det Fortrinligste, som af den ?lrt er fabrikeret her i Landet. O ni Fremgangen med Arbejderne ved Danne« virkkstillingei! bedder det i en korrespondance fra Flensborg i Fyens Av.: N amnesi Slesvig By bcstaaer Beferstningen af en Rakke Skantser fra Sliens Bred. »middelbart £|1 for Forstaden Bustrup mod Svtvest ud til Landsbyen Store Dan- uevirke. Deres Antal er i2, og de ligge spredte paa c» Hoideryg, Syd for hvilken Sidebanen fra Slesvig til Stationen Klpsterkro er anlagt, med indbyrdes varende Afstande, eftersom man fjerner sig fra Byen. Te fleste af disse ere aabne og kunne betragtes som enkelte losrevne, af Jord vpsortc Bastioner, som vende mod Syd, hvor te ere beflyttede mod Angreb ved en hoi omgivende Volt, medens Adgangen fra Nord er fri; andre, saalrdes den iOte og i 2te Skantse, hvilken sidste ligger tæt op til Landsbyen Store Dannevirke, ere lukkede Skants.r, bestaaende af ren sammenhængende Jordvolt, hoi og bred, em- given af en dyb og bred Grav. Ten eneste At- gang til Skantscn dannes af en over Graven kastet Bro. dannet af lose, ved Siden af hinan- den lagte Bjerlkcr, som hurtigt og let kunne kastes af. Igjenncm en svcrr, med Skydestaar for- sonet Port af Tomnier kommer man ind i selve Skandsen, i hvis Midte er anbragt et Bkokhuus, som er istand til at rumme c. i 20 Mand, det staaer i en lille Fordybning paa niuret Underlag, er opfort af det sverreste Tommer og paa alle 4 Sider spækket »ned Skydestaar, hvorfra vore",doms_aviser_page:uuid:dcbfca4a-7e95-42c9-8891-40d79d8457ac,doms_aviser_edition:uuid:cb64da23-56bb-4591-bb6c-1b31cb65cec8,doms_aviser_title:uuid:7f6084e3-521f-433b-8451-73a897cdc053,viborgstiftstidende 1862-05-08 001,viborgstiftstidende,3,1,Viborg,Bred\nBustrup\nGraven\nFaaborg\nSlesvig\nMiddelfart\nDannevirke\nTivoli\nFredensborg\nByen,"10.1029573732,55.3775436056\n10.1051144833,55.3733993436\n8.81141925297,56.5852738858\n10.5043265426,56.1334266969\n10.249283632,55.0953698188\n10.0473406515,56.6761094867\n9.74486903146,55.4994582561\n10.4004231607,56.1789658383\n10.4022733364,54.8808300073\n12.3776744149,55.84504539\n12.407468767,55.9767682151\n8.39276925385,55.4329764527",16.98909523809526
