link,recordID,timestamp,pwa,cer,fulltext_org,pageUUID,editionUUID,titleUUID,editionId,familyId,newspaper_page,newspaper_edition,lplace,location_name,location_coordinates,sentiment
http://www2.statsbiblioteket.dk/mediestream/avis/record/doms_aviser_page%3Auuid%3Ae8b79cf2-e22b-411e-b527-485abaea9c82,doms_newspaperCollection:uuid:e8b79cf2-e22b-411e-b527-485abaea9c82-segment_4,1862-06-02T01:00:00Z,52.4,0.476,"Hds. Maj. Enkedronningen bar ladet Besty- reisen for det nortiste Stiidentermodk meddele, at Allerboists. onflcr ar modtage 10 af de for- ventede Gjæstcr i Logis, og HS. kgl. Hh. PrindS Ehristian bar ligeledes i Torodags lader sig tegne for 6 Gjæner. Te! cr smukt, at Kongehusets Medlemmer kappes med dels dbef i at vise na- tional Gjæstfriher. Det ovemra givne gode Er- cmpel bar ogsaa allerede virket heldig, thi i te sidste Tage er Indtegningen for Gjæstcr gaaet meget levende. (Fdrl.) Ten Forestilling, som vil blive givet i dct kgk. Thcater under Studenterniodet i Kbbvn., vil, efter Forlydende, komnie til at bcstaae af de tre mel- lcniste Arter af „Icvpc paa Bjerget"" samt „Nei"". lFk. Av.) Ten 22de Mai dodc i Kjobcnbavn Danmarks ældste Læge, Regimcntschirurg Wcngel. Han var redt 1783. (Fk Av.) l ime roser i sil sidste R'r. meget te fra ten kongelige Porccllainsfabrik u t st i ll ede Gjeu- stande, som den c: estc virkelige Reproduktion af gammelt s a eb si st Porccllain med Hensyn ti! For- nierne, den sine Maling, ten smukke Glossering og den sultkomne Brænding; selv te udstillede moderne Arbejder fra Dresden gjengive flere af ten gamle Vares Fcil end af rens stjonne Egenflaber."" I Mandags indtraf atter det sorgcligc Tilfælde, at c» Mand druknede i Faaborgfjort. Ten Af- rode. ler var Hjuulmane og bosiddende i Kat- tcro, vilde tilligemed sin Zarer scile over til Afro. men blev udfor Svelmo af cr af Seilenc kastet overbord og trods alle Anstrængclscr formaaede Faderen ikke at redde ham. Han efterlader sig Kone og 3 Born. (Faab. Av.) Fra Ekernforde berettes i „A. M."" om en Tom der klinger noget forunderlig, bvis man ellers kan fæste Lid ril Meddelelsens Rigtighed. En Tobaksfabrikant stal, ester Beretningen, være bleven anklaget, forti hans Kutff bar et lovstri- digt Liberi (morkcblaat. besat med Gult), og Ret- ten i Ekernforde stal have tomt ham til en Bode af 320 Rd. og Kutstcn til 8 Tages Fængsel paa Band og Brod. Tommen angives at være af- sagt i Henhold til en Forordning af 1812, der emanerede paa Grund af te daværende trykkende Pengeforbold, men ilke, trods te forandrede Ti- der, siden cr bleven hævet. Tommen cr appel- leret til Apvcllationsrcltcii. Ehristi Himmelfartsdag, efter endt Gudstjeneste, blev der i Seest Præstegaard af en D cl Beboere i Seest ni. Fl. overrakt dcn bidtilv. Sognepræst, Hr. Pastor Schmidt, ter cr bestikket til Sogne- præst for Gruntfor og Sporring Menigheder i Aarhuus Stift, som c» Anerkjentclse for hans 12aarige heltbringende Birken som Præst for Seest Menighed en Hædersgave, bcstaaentc af en Solo Bordopsats med passende Instripricn. (Kolt. Av.) Ta et Par ældre Bonterfolk forrige Lovcrdag kjoitc fra Hjorring, vare Hestene muntre, faa Manden ikke havde ret Holt paa dem. Vognen tornede faa voldsomt imod Kjohuant Jacobsens Huushjorne, at begge te Gamle styrtede ur af Vognen. Manden faldt ned paa Hamlen bag ved Hestene, hvorimod Konen kom paa Hovedet i Stecuhroeu. men tillige faa ubcltigt, at hun ved Klæderne blev hængende ved det ene Hjul og flæbt rundt mcd dette, saaledcs at Hovedet sterc Gange flog imod S teen broen, hver Gang efterladende et Blodspor. Hestene ter nu vare paa Vei til at blive lobjke, standsedes dog strar efter udfor Kjobmaud Jungets Boutik, hvor Ko- »en blev indbragt i blodig og devilstlos Tilstand, medens Manden var fluppcn nied en Qvæstelfe paa ten ene Haand. Konen, ter senere er fort til sit Hjem. stal dog være uden Fare. og »agtet sin forflaactc Tilstand fortiden fole incest Smerte ovcr de iturevne Klæder. (Hj. Av.)",doms_aviser_page:uuid:e8b79cf2-e22b-411e-b527-485abaea9c82,doms_aviser_edition:uuid:6f8d770d-ef6f-45c2-b5b1-3e7e3e817538,doms_aviser_title:uuid:7f6084e3-521f-433b-8451-73a897cdc053,viborgstiftstidende 1862-06-02 001,viborgstiftstidende,2,1,Viborg,Kongehuset\nBjerget\nBode\nBirken\nSeest\nHovedet\nJunget\nBrod\nHolt\nGrund\nKolt,"9.28627554018,55.4894646795\n8.99461849483,57.1042890417\n9.66013614664,57.0757443419\n11.8898875699,55.4745485781\n9.61444820608,54.9110494193\n10.3200470557,55.2908268957\n9.02253358324,56.449915262\n10.305177418,56.4779087155\n9.83157209692,56.1631114896\n9.39815889458,56.8229096003\n9.44177494977,55.4874029693\n10.6584180146,55.4698770187\n11.3875731915,55.651792334\n11.3679861243,55.1982157372\n10.2899515737,55.4528008246\n8.56856581953,55.2736102362\n9.09983283864,56.7638073073\n9.65794260438,55.2806694476\n8.97932065907,56.051790979\n10.206807113,57.515027476\n12.290835647,56.0806783136\n9.2296350403,55.4297028446\n9.08067632431,55.3168314954\n10.2931522694,56.4651947577\n9.757801692,55.699493073\n10.0715039481,56.1059237339",11.996999999999996
http://www2.statsbiblioteket.dk/mediestream/avis/record/doms_aviser_page%3Auuid%3A956c847d-179c-415d-98ca-34217a99485f,doms_newspaperCollection:uuid:956c847d-179c-415d-98ca-34217a99485f-segment_6,1862-06-10T01:00:00Z,49.4,0.506,"Licitation.\n(S jter Justitsministeriets Bestemmelse afholdes Licitation over Muiirarbcivc, Tommcrar- beivc, Zcrnftoberarboivc, Blikkenfla- gerarbeive, Ikiferverkkcrarbeive i.rmt Veveriag af Tomiuermaterialier og Grnnlsteen lil Cm> og Tilbygningerne ved Sftaffcanstalien i Viborg. Licllalionsconditionernt og Tegninger ligge til Eftersyn paa JnspeclionSconioirel ved Straffe, anstalten i Viborg og bos Archilect N. S. sftebelong Norrevolo Nr. tj i Stuen hver Sognevag fra Kl. 9—12. De som ville ovetlage disse Arbejder og Le» veringer eller nogen Teel af samme ville ind- levere deres Tilbud i forseglede Sedler med Paa- tegning om hvad Budet indeholder, til Jnspec- lioiisconloirel ved Straffeanstalten i Viborg inden len 30te Juni d. A. , paa hvilken Dags Middag Kl. 12 Tilbudene ville blive aabncle i Overvcrrclse as le Tilbydere, som have ind- fundet stg.\nKiobenhavn. den 7de Juni 1862.\nR 3. Rcbelong. Proclama.\nCrediiorcrne i Boet ester asooe Asisgisenke Ma- ren Nielsd atter as Romlund inrkalrcS herved med 3 Maanctcrs Varsel lil ser undertegnede Skisieforval- ter at anmelde og beviisliggjere deres Krav. Ligeleees indkaldes mer lovligt Barsel Arvingerne ester ren Asdorc, rer tsolge Tcfta, »ente as 22de Decdr. 1838 som eneste Arving i sin Tid har liltraart sin MandS Iver Jensens Bo, til for Skifteretten al »itlrc sig og legitimere deres Arvederettigclse. Fjents-Rorlyng Herreders Contoir i Bidorg, ren 2den Juni 1862. Platon. Alle og Enhver, tom maane hare Nogei al forore i Boet efter afoorc AflaglSmand JenS Ebriftenfen Hoiluiio af rangaae, indkaldes herved med 3 Maa nedcrs Barsel lil, for iinleriegnede Sktfieforvalter, at anmelde og devise deres Fordringer. Middel'om-Sonderlyng Herreders Eontoir i Viborg, den 2den Juni 1862. B. H Borgen. Alle' og Enhver, der maattc have Noget- at fordre i Dersboet ester Ungkarl Thøger C h rislen sen a, Rind. Laaslrup Sogn, indkaldes herved under For- tadclse af keres Krav til inden 3 Maaiieder. overcens- stemmende med Lov as :10te Novdr. 1867, at anmelde og devise deres havenre Fordringer for undertegnede Skifiesorvalter. Rinds Herreders Contoir i Hobro, den 3die Juni 1862. t> Christensen. (Redigeret , trylt og udgivet af H. Missing- )",doms_aviser_page:uuid:956c847d-179c-415d-98ca-34217a99485f,doms_aviser_edition:uuid:bad2ada5-a216-45af-95d3-22285af8a6bc,doms_aviser_title:uuid:7f6084e3-521f-433b-8451-73a897cdc053,viborgstiftstidende 1862-06-10 001,viborgstiftstidende,4,1,Viborg,Hobro\nViborg\nBoet\nRomlund\nStuen\nMiddag\nBorgen\nRind,"9.80074263501,56.6396207954\n9.78251116628,56.6434292957\n9.40176695552,56.4443347362\n15.0333976293,55.1336209692\n9.30280944468,56.4816130018\n9.0788517671,57.1405839079\n8.22298370274,55.5787928914\n10.4580351353,57.4151316479\n14.904393158,55.1859929168\n12.3252429005,56.0118586378\n12.2037701659,55.844513199\n8.9601750452,56.0903132854",13.425
http://www2.statsbiblioteket.dk/mediestream/avis/record/doms_aviser_page%3Auuid%3A635d20bd-cca8-46ae-9834-18c1eacdcd0b,doms_newspaperCollection:uuid:635d20bd-cca8-46ae-9834-18c1eacdcd0b-segment_3,1862-06-17T01:00:00Z,53.7,0.463,"under danff Flag i Foraaret have besogt St. Francisco's Havn. Fleertallet as Kystsarloicrne fare vel under americanfl Flag ; men de fleste af dem tilhore danfle Rhedere og itetmintste en Trediedcel as Sofolkene vaa Fartoierne, der be- scile te derværende Kyster, Bugter og Floder, stammer fra Danmark og Hertugdommerne. I Minerne fortjene dygtige Arbejdere nu daglig 2z til 4 Dollars. En dygtig Tjenestepige faaer 20 til 30 Dollars om Maaneden, c» dygtig Tjene- stekarl 20 til 25 DollarS on> Maaneden eg Alt frit. Fer enhver Arbejder, men navnlig for Tjenestepiger, er Californien et udmærket Land. Tcrimod er her aldeles Intet at gjore for Han- retsbetjente og Læger. Det vilre være mig let- tere, flutter Censulen, at serflaffe 10,000 Tjene- stepiger gode Conditioner med 20 Dellars om Maaneden, end 10 Handelsbetjente Plads nied samme Lon. (Dvk.) Som tidligere medteclt, er. der bevilget kgl. Skuespiller Hnltmann en Rciseunderstottclse af 300 Rd. Da Hr. Hnltmann imidlertid paa Grund ar Sygdom ikke kan foretage nogen Reise jaar, er det nævnte Bclob efter „Berl. Tid/ til- staact Ballctregisscnr. Sccontdanser Fredstrup. Eiidvitcre er der bevilget Cnnek ( heol Magnus Eriksen til ferisat literair Virksonibed en Understetlclse as 200 Rt. En Officin, Prcmierlieutenant H., fik ved Isted et Ekudsaar i den venstre Skulder og blev, ef- tcrat Kuglen var udtrukken, belbretet. Dog brod Saaiet i 1853 atter ep, idet en Bcensplint havde arbeidet sig frem, men var dog snart efter igjen lægt. Nu bar ten nævnte Officin efter 9 Aars Forlob, i hvilket Tidsrum Armen har været al- deles rafl og sund. atter maattct underkaste sig cn Operation. Lægen meente, da Smerterne indfandt sig, at det Hele blot var en Smule Rbeninatisme. men det viser sig nu, at en Becn« splint atter hor arbeidet sig frem og soraarsagrt Hævelsen. (Flp.j Ten bckjendte norsse Bondcspillcmand Torgeir Andunson, meest bekjendt under Navnet Mellar- gutten, bvis mærkelige Violinspil overalt i Norge har vakt Beundring og vundct Ole Bulls hoieste Aiierkjendclse, vil ester Forlydende give endeel Conccrter i Kjobenhavn. (Fædrel.) For at ovnaac cn dobbelt Iordbærbest i eet eg samme Aar anbefales, efter den sædvanlige Hest, at affljære Blade og Frugtstængler tæt over Reden, derpaa at paafylte et tvndt Lag frifl Jord eg vande Planterne, der da ville flyde nye Blade og Blomster, og en anden Frugtbøst kan ventes. (Fk. Bl.) Det kjobenhavnffe boierfle Ol er nu ogsaa meget søgt i Hamborg. (Sierne as de derværende Olballer secs derfor hyppigt i „Hamb. Nacbr."" at avertere, naar de have modtaget nye Sendin- ger. og at angive en bestemt Dag, da der flal stikkes Hul paa en ny Tonte. Skolemodet i Odense tretie Pintsedag var, ifølge „Fyens 'Av/, besogt af 158 Dceltagere. Forhandlingerne begyndte med at afsende føl gendk Telegram til Minister Monrad: „I de sidste 10 Aar har intet almindeligt Lærermøde været afholdt i Fyens Stift. I denne Tid ere de vig- tigste af Skolelærernes billige Olsker blevne op- syld te, ligesom der ogsaa er virket overordentligt meget for LærcrncS betre Uddannelse og Folke- oplysningens Fremr.ik. Jtag er atter et saadant Møde traatt i Kraft bcr, men vi kunne ikke be- gynte sammes Forhandlinger uden forst at have bevidnet den Mand, der fremfor nogen Anden har virket fer disse beltbringende Resultaters Opnaaelse. ver dybtfølte Højagtelse og Tak. Gid Deres Erccllcnce længe maa beholde usvækket Kraft til at fortsætte det saa vel begyndte Lærk!"" — Fra Minister Monrad indløb kort efter føl- gende Telegram: „Til Dccltagerne i Skolemødet i Odense tredje Pintsedag 1862. Den fra Mødet",doms_aviser_page:uuid:635d20bd-cca8-46ae-9834-18c1eacdcd0b,doms_aviser_edition:uuid:09a4a4ff-645b-4d34-8db0-065beacb6ad4,doms_aviser_title:uuid:7f6084e3-521f-433b-8451-73a897cdc053,viborgstiftstidende 1862-06-17 001,viborgstiftstidende,3,1,Viborg,Norge\nHamborg\nOlsker\nReden\nGrund\nAars\nOdense,"9.80491708262,56.5093821893\n9.15169549892,55.5933995115\n8.8549186596,56.9338965496\n8.65064095876,57.1137021755\n14.7971900134,55.2428442468\n11.320028071,55.6377816499\n10.7649373221,55.3859108318\n10.2931522694,56.4651947577\n9.757801692,55.699493073\n9.51368182691,56.8025344518\n10.3884101631,55.3994475975",56.800611111111145
http://www2.statsbiblioteket.dk/mediestream/avis/record/doms_aviser_page%3Auuid%3Aab206133-c240-4240-8697-c5d1b3d89e3e,doms_newspaperCollection:uuid:ab206133-c240-4240-8697-c5d1b3d89e3e-segment_1,1862-06-26T01:00:00Z,54.4,0.456,"niaade ombord og Bcflassenbeten af dot sclflabe- Iizc Liv cr rirkclig i flere Henseender gansse in- kcrcssant og fiemdyber flere morsomme Puncter. hvilke jeg dog for IZTicMiffct ikke er oplagt til at gaac norrmerc ind paa. Efter en rolig Fart gjen- nem Kattegat passerede vi Skagens Fyr Fredag Morgen Kl. 2. og ta vi vare komne ud i Nord- soen fandt vi der en stcrrk Sogang med en rast Kuling. Det gode Lune. son, indtil nu havde dcsjcrlet Passagererne, blev pludselig forvandlet til en almindelig Trang til at ligge ned, og tc- reS Antal, son, ikke ossrede til Neptun, var ikke stort. Vi fortsatte imidlertid Farten indtil Mit- tag, da ror Eapitain bcstuttcde stg til at foge Ly under Skagen, fer at llvcirct ikke stulde blive af altfor stemme Folger for Passagererne i det meget indskrernkcde Rum, der er dem indremmet cm Natten. Vi vendte altsoa, vasserede atter Skagens R>v og kastede Anker lige udfor Byen, hror ri endnu ligge idag og vente paa at kunne sortsertte Reisen uden at have baade Vind og Strom lige imod os. Saasnart Tampflibct „Hekla"" kommer tilbage fra Touren til London, vil tet atter afgaae der- til med 150 Kunstnere, Haantrerrkcre. Fabrikan- ter, Handlende, Forst- og Landmand, Gartnere osv., naar et saa stort Antal tegner sig inden den tste Juli. Betalingen for Tour og Retour samt Kosten under selve Reisen er bestemt til 10 Rd. kinder Opboldet i London maae de Rei- sende selv sorge for Kost og LogiS. Det cr i Henhold til derom indgivet Andragende fra „Bestyrelsen for Haandverrkersoreningen"" i Kbhavn al Indenrigsministeren med Marincbestyresten har arrangeret denne Tour. Pintsesontag, ten 8de Juni d. A., seirede Ler- rer ved del kgl. Vaisenhuus i Kbbarn A. F. E. Gulbrandscn og Hustru Ane Margrethe, fedt Lunt, deres 50aarige Bryllupsdag , omgivne af deres 6 Born og 7 Borneborn. Gnlrbryllnps- parrct cr i Besiddelse as usvcrkkcde Aands- og Le- gemskroeftcr, og Gulbranbsen, der i henvcd 46 Aar har virket som Levrer, arbejder endnu i sit Kald ni cd Kraft og Dygtighed. Mange aldre og yngre Elever benyttede denne hoitidclige Lei- lighed til at bevidne dette haderlige Jubelpar deres Hoiagtelse. (Flop.) Etsr. Tcsdorph har i Landhuusholdningsscl- stabct paaviist, hvormeget de vigtigste Eristents- midler cre stegne i Vardi i de sidste 16 Aar i Sammenligning med 1820—46: (ifolge Eapi- lclstarterne og Kbhavns Torrcpriscrl Hvede 47 pEt., Rug 38,- Byg 54, ZErter 58, Flest 56. Smor 64, Brande 22, Uld 36; i lignende For- bole cre Priserne paa Kaffe, Hor og Lader samt omsider paa Huusleien stegne. (Tvkc.) Det var at sorndsee, at Jndsorclsen af Syina- stiner vilde lede til, at disse tilsidst vilde blive et unndvarligt Rcqvisit i enhver Huusholdnina. Saarjdt cre vi nastcn allerede komne. Man faacr i Kbhavn, isolge „Fk. Av "", Syniastiner, der med Bord og alt Tilbehor salges for 12 Nt. Hele Indretningen indtager et Fladrum af c. 8 Tommer i L.vadrat. omtrent det Halve af den Plads, et almindeligt Sybord indtager. Man kan paa disse Mastiner, naturligviiS med nogen øvelse, sye saavel Linned og Silke som Klate. Det cr en Selvfolge, at te ikke i enhver Hen- seende kunne prasterc det samme som de storre og dyrere Mastiner. men de have ogsaa frem- for disse den Fordcel, at Mcchanismen er saa simpel, at te i indtrcrdende Tilsaelde kunne repa- reres af cnbver Metalarbeider. Klampenborg Badeanstalt har ikke i mange Aar bavt et saa tidligt Besog af Kuur- og Ba- dcgjerster som iaar. Fra Svcrrig kom allerede i Mai baade Familier og enkelte Rejsende dertil, cg Flere blcvc stadig anmeldte. Ogsaa Mange fra Provindsernc synes iaar at ville bcsogc dette danstc Badested, der tillige i Tydstland har bc-",doms_aviser_page:uuid:ab206133-c240-4240-8697-c5d1b3d89e3e,doms_aviser_edition:uuid:e8c30f00-27e3-4df6-a8bb-9fa41ddfd8ef,doms_aviser_title:uuid:7f6084e3-521f-433b-8451-73a897cdc053,viborgstiftstidende 1862-06-26 001,viborgstiftstidende,3,1,Viborg,Vind\nBrande\nKattegat\nSkagen\nByen\nKlampenborg,"8.56361492017,56.2589837916\n9.46459476649,56.0983677668\n9.12172723295,55.9431494909\n10.7875479197,56.5320614791\n12.3291642745,56.1201520271\n10.5922261923,57.7240171304\n10.5702631376,57.7255760849\n8.39276925385,55.4329764527\n12.5861441282,55.774947521",20.22592592592594
http://www2.statsbiblioteket.dk/mediestream/avis/record/doms_aviser_page%3Auuid%3Af4897c53-94de-426c-9568-6583e575c3f0,doms_newspaperCollection:uuid:f4897c53-94de-426c-9568-6583e575c3f0-segment_4,1862-06-28T01:00:00Z,51.3,0.487,"UdenlandD.\nKrankrig. „Hamb. Borsenh.s"" Pariscrcorrespondent for- tæller, at ten feif. Familie fortiten i Fontainebleau morer sig isoer med Lystsejladser paa ten store Dam i Slotshaven. Keiserindens „Nodde- staller"" flulle vare sande Vidundere af Elegance. Til den feif. Prinds har man bygget en Pant- serfregat i Miniatur, 8 Al. lang. med 3 Master. som, fuldkommen tiltallet, assyrer sit mikroskopiske Skots med den storste Noiagtighcd. Kei- feren selv stal bare en staerk Lidenskab for „at trake Vande"", z: al satte Folderne i to sam- nienlankete Smaabaate og saaledes styde stg fremad, idet man holder Ligevagten ved Hjalp af en lang Balancetrstang ; desuden arbejder han paa sin „Julius Easars Historie"" og raadflaaer med sine Ministre, Generaler og Admiraler om det mcricanste Anliggende. Paris, ten 33de. Jfolge l'atrio vil At- niiral Graviere i en vigtig Eendelse vende tilbage til Merico (hvor Gen. Forey, ter alle- rede paa Krim og i Italien har bavt en selv- stantig Eomniando og derfor nu er bestemt til at erhverve sig Marscbalstaven, stal fore Eom- »nantoen over bele ten fransse Styrke); Gen. Lorenccz er sultstandig forsonet med Levnetsmid- ler og holdt enrnu ten 14ce Mai Amazoc, 2 M. fra Puebla. besat. Paris, den 24te. Gen. Douay (som den i 7 te Mai landede med en liden Forstarkniiig — 500 Mr.? — i Vcra-Eruz) har vundeten Forteel sover de Mericancre, som sparrede For- bintclseu med Een. Lorencez, ved Orizaba?) — Det betler, at de Forstarkninger. som nu afsen- tes, for den gule Febers Skyld ikke flulle lande i Vcra-Eruz, nicn i en anden sundere niericanst Havn. — Man taler em, at den legitimististe og ultrakatbolste Gesandt Salignac i Merico, som har fluffet Kejseren ved sine Beretninger oni Meri- canerncs Tilboielighcd til et Monarchi, stal kal- des tilbage. Italien. Tur in. ten 4de. Erispi dementerer i Dirilto, at Garibalti skulde have nedlagt Forfadet i „Eman- cipationsforeningen"" : „Ustadigheden af hans Bo- pal bar kun nodt ham til at konstituere ham (Erispi) fem Foreningens Prasitent."" — Et kgl. Decret befaler, at Universitetet i Pavia stal lukkes. — Ila'ie paaslaarr, at de Franfie nu (efter Occupalionslroppcrncs Formintffelsc) ville romme den pavelige Provinds Viterbo (Nord for Rom). Tytskland. Kassel, den 24de. Efter Forlydende er Ge- neral Bardclebcn »dsect til at overlevere Kongen af Preussen et ezenbantigt Brev fra Kurfyrsten som det forstc Skridt til igjen at knyttte den af- brudte diplomatistc Forbindelse.",doms_aviser_page:uuid:f4897c53-94de-426c-9568-6583e575c3f0,doms_aviser_edition:uuid:a07e27fe-a662-40a0-8976-92c8d8fb4263,doms_aviser_title:uuid:7f6084e3-521f-433b-8451-73a897cdc053,viborgstiftstidende 1862-06-28 001,viborgstiftstidende,1,1,Viborg,Rom\nSlotshaven\nParis,"10.1468686071,57.3407021087\n9.23751020417,56.0992288801\n12.5006973204,55.8734954447\n12.2109693584,54.8855110208\n12.3073033752,55.939436849\n8.48985059238,56.5142124559",18.311111111111106
http://www2.statsbiblioteket.dk/mediestream/avis/record/doms_aviser_page%3Auuid%3A457e8de9-4310-44fb-8f2d-36244b3ec0be,doms_newspaperCollection:uuid:457e8de9-4310-44fb-8f2d-36244b3ec0be-segment_1,1862-06-30T01:00:00Z,54.7,0.453,"Ecm tffjdiH fandt i floret 1860 ct telydcligt Vedtagen Sted red den i Jylland deliggende saokaltte „None Holmgoord"". idet en belydelig Tccl af d.n derpaa varende Besalning, Avlsred flader etc. blev bortsolgt derfra. I den mod 1) Ehr. Ludvig Johansen. 2) Nicolai Vulow og Z) Carl Marius Jergenscn indledede crin-iii'Uc Undcrsogclse har Hoicstcret i Tirsdags, cstcral Sagen har varet foretagen ved Ekodborg-Vaiid- fuld Herreders Ertraret og senere ved V'borg Lands- overret. stadsastet sits lnavnte Reis Tom. hvorve Forslnarnte er frifunden for Aktor« Tiltale, de 2 Silslnavnte derimod d-mtc til at hcnfati.s i Fangs.l paa Vand og Vred hver i 6 Gange o Dage. Tcn i sorr. Maaned i Kbbvn askede Grosserer Moritz 11 n n o. son- har efterladt sig en betydelig Formue, bar.tfter Forlvdeude. disponeret over den paa felaeiidc Maade : En mindre Tecl flal strar tilfalde ten jodistc Menighed, hvorimod hans og tidligere aflede Kones Slægtninge flulle nyde Renterne af Resibelebet. saalangc de leve. Ed terhaanden som de »dlee. stal Hovedsummen til flyde et Fond. bvoraf Halvdelen flal vare et Le- gat for Enker og Vorn efter aflede Militaire. navnlig faadanne. der ere faldne r Kampen for Danmark, og den anden Halvdeel stal tilfalde Ajy lerne og Vernebospitalet. (gf. Av ) Etatsraat. Professor Eoren sti. I. B loch. for heuvarende Rector ved Roeskilte Katbedralstolc oa en af vore meest fortjente Skolemand, er i Fredags afgaaet ved Teten i den boie Alder af 90 Aar og 4 Maaneder. Han fungerede som Rector indtil Efteraaret 1851 og har varet > offentligt Embede i nastcn 58 Aar. (Vl. T.) Kassereren ved den kongelige CentralkaSse i Flensborg. Jus, itSraad R. Voldt. Ridder afD.. er den 26de DS. afgaaet reb Toden i en Alder af 72 Aar. (Bl. Td.) Pastor Scbuniocbcr er sunken dybt. Jkle en gang ..Nordtkuts-ber Grenzbote"" vil mere kjendes ved ham. Den heiarrartige Herre bar fra Bar men tilstillet det navnte Blad en Skrivelse, hvori han bebuder at have udgivet et nyt Skrift: »Per gerechtfertigte ScbleSvigbolstkinismus"" . og ban ni.ner. at enhver upartifl Laser „n let vil kunne overbevise sig om. hvorvidt Bebrejdelserne for Vild farelser og Log» ramme ..ban, og hans Lands mand"" eller ..vore (Slesvigbolstenernes) Mod- standere-. Han ender sin Skrivelse med indtrængende at anmode Redaktionen af „Nordd. Grenzb. om at vise „en sorhaanct god Sag og e» svar bagtalt Mand"" en vigtig Tjeneste ved at oplage Meddelelsen om Skriftets Udgivelse. „Nordd. Grenzb."" viser bam den forlangte Tjeneste, men tilfeier: Vi ville onsse. at det maatte vare luk kedes Hr"". Schumacher at modbevise ten mod ham r eistt Beskyldning for Usandfærdighed, men kunne dog ikke undlade, med Hensyn til ten af ham for banS Skrift valgte Titel („Ten retfærdiggjorte Schlcswigbolstcinisme-) at minde om, at Scbles- wigholstelniSnieii aldeles ikke staaer i nogen soli darifl Forbindelse med hans Sag"". (Bl. Tr.) Befæstningsarbejderne vec Slesvig blive nu atter optagne med temmelig stor Iver. Opstem ningsdigerne paa Engene fra Reite til Holling sted blive alle betydelig forstærkede, og fremdeles piadcgyntes Arbejderne ved ten gamle Margrethe. Vold Sonden for denne stal ter graves en Grav i en Dybde af 20 Fob og 10 Fod bred i Bun den. (Tvk.) AarhunS. den 28de Juni. I Morgen de fares hele Jernbanelinien fra Aarhuus til Ran ders forste Gang med Locomotiv. Afgang Kl. 6 Formidtag fra Aarhuus Station. (Byens A.)",doms_aviser_page:uuid:457e8de9-4310-44fb-8f2d-36244b3ec0be,doms_aviser_edition:uuid:a0042174-d0ac-4e77-ae59-d8102e3cb10d,doms_aviser_title:uuid:7f6084e3-521f-433b-8451-73a897cdc053,viborgstiftstidende 1862-06-30 001,viborgstiftstidende,3,1,Viborg,Slesvig\nVold\nEngene\nBar\nJylland\nByen,"10.0473406515,56.6761094867\n9.57741712986,55.0340780595\n14.9989973901,55.1495956191\n10.1804891698,55.1772793663\n10.5702742697,55.0499525374\n8.52865322878,56.2666722746\n9.49525153449,56.0571694118\n8.39276925385,55.4329764527",11.048148148148128
