link,recordID,timestamp,pwa,cer,fulltext_org,pageUUID,editionUUID,titleUUID,editionId,familyId,newspaper_page,newspaper_edition,lplace,location_name,location_coordinates,sentiment
http://www2.statsbiblioteket.dk/mediestream/avis/record/doms_aviser_page%3Auuid%3Afcb40911-ba47-4995-be18-eacf97b3f7f5,doms_newspaperCollection:uuid:fcb40911-ba47-4995-be18-eacf97b3f7f5-segment_2,1862-08-21T01:00:00Z,61.5,0.385,"sul Windseld af Hjerting fik Tilslag paa n armere Approbation for 21259it. Noget lost Tommer og Broens Inventarium udbragtes til 112 Rd. 40 Sk. Tet var altsaa den Landingebroes Sljabne. hvortil der engang knyttedes saa store Forhaabninger. (Byens Av.) Fredericia, den 10de August. Et sergeligt Ulykk.stilfalde er idag indtruffet bcr i Byen. Ved Nedbrydelsen af et Hnus, som horer til le af Militairctaten til Magasinbrng nylig kjobtc Fabrikbygninger. faldt nemlig cnMunr ned over to Arbnderc, af hvilke den ene, der hedder Mol- ler og flal vare hjemmlhorendc i Nærheden af Ehristiansscld, strar ibjelslogcs, medens den an- len. Arbejdsmand Jacob Blom her af Byen, haardt qvastedeS. En trcdic Arbeider. som lige- ledes befandt sig tat vel Mnren, da den styrtede ned, blev lylkeligviis aldeles n skalt. (B. A.) Tet er tidligere meddcelt, at Peder Lucassen? Gaard i Hedeby, Skjern Sogn, iaar er afbrandt 2 Gange, forfie Gang den 26de Ian., anden Gang den 10de Juli efterat vare gjenopfort og indtegnet under Brandforsikkringen. Samme Gaard, der paany rar under Opforelsc afbrandtc i Loverdags Eftermiddags, saa det er et mar- keligt Uheld, der sorfolger Eieren. (Rgk. Av.) I Anledning ak, at „Aalborgpostcn"" indeholdt en formcentlig vildledende Fremstilling af Aal- borgs commnnale Status, besluttede Byens Eom- munalbestvrclse efter Kbm. Stauns Forsiag med 15 St. mod 3, at K omnieren fluide i Bvcns tv Blade lade indrykke cn Oversigt over dens oeco- nomifle Status; men Berg c mest er Morcb, bc- raabendc sig paa 2 i Loven af 23de Januar 1862, fn spender ede denne Beslutning. Kbm. Hartvigsens og Raadmand Krebses Foresporgsel om denne Suspensions Lovmedholdelighcd bar Indenrigsministeriet den 13dc besvaret te nægtende og anmodet Amtmanden om at paalaggc Borgemcsteren at udfore Eommunalbestyrclsens Beslutning. ' Eommunalbcstyrclscn i Th i st e d har nylig ind- givet et Andragende til Indenrigsministeriet, hvori den atter fremkommer med Indsigelse mod en eventuel Bro over Liimsjordcn, fordi den i hoi Grad vil hindre hele Vestegnens Skibsfart og det her altsaa ligefrem vilde vare at begunstige den Enkelte paa det Almenes Bekostning. Med stormende men dog sejlbart Veir vil det vistnok som oftest vare umueligt at aabnc Broen saa hurtigt som fornodcnt, hvilket kan afstedkomme Fare for Skib og Ladning, tilmed da Ankerbnn- den vestfor Aalborg er overordentlig blod, og det vil ialtfald blive tvivlsomt, hvor og hvorvidt Skaden vil blive erstattet; om Natten vil rime- ligviis al Gjknnnnfart vare afspærret, og det ofte til uberegnelig Forsinkelse af Skibets Ncise; Fartoier kunne baade fra Ost og Vest folge saa vedholdende paa hinanden, at Færdselen over Broen tilt i flere Timer vil vare standset, hvoraf atter Folgen bliver, at senere ankomne Skibe maa ankre op indtil Broen er passeret af den tilstrommende Mængde fra begge Sider af Lan- det. Tisse eg endnu flere Baant vil cn Bro lægge paa Sejladsen i Fjorden, og det kan ikke Andet end fordanse at see den hindret paa dette Punct, medens man ved Logstor har sygt at fremme den ved et kostbart Kanalanlæg. (Th. A.)",doms_aviser_page:uuid:fcb40911-ba47-4995-be18-eacf97b3f7f5,doms_aviser_edition:uuid:29db1fe8-c93c-4f51-bde1-0e3dcc92ac12,doms_aviser_title:uuid:7f6084e3-521f-433b-8451-73a897cdc053,viborgstiftstidende 1862-08-21 001,viborgstiftstidende,3,1,Viborg,Hjerting\nAalborg\nSkibet\nSkjern\nHedeby\nByen\nFredericia\nBroen,"8.36444276062,55.5238239277\n9.03855280907,55.3930524441\n9.93146311931,57.025292765\n9.91683917278,57.0428743893\n9.45282702499,55.7111498478\n8.49892955597,55.9485793386\n8.39087091756,55.9630709333\n9.19337337467,55.8143996497\n8.47113432919,55.9389478973\n8.76809395557,55.9771255337\n8.39276925385,55.4329764527\n9.72652538807,55.5538163271\n12.0278071714,55.7387928916",-8.67962962962962
http://www2.statsbiblioteket.dk/mediestream/avis/record/doms_aviser_page%3Auuid%3Ab0f1cc6c-a0c1-4899-b404-e1b90cd53033,doms_newspaperCollection:uuid:b0f1cc6c-a0c1-4899-b404-e1b90cd53033-segment_3,1862-08-25T01:00:00Z,57,0.43,"Adresse -Avis.\nMandagen den 25l»e ugull !Ll»2.\nfarelser, vedblive bevabnede Bander at forene sig under Garibaldi. Bescrllelseii af cn betydelig Stad (Catania) er en aabenbar Oprorehandling. Regjeringen er fast bestemt paa at gjore cn Ente paa en Tilstand, ler scrtter Italiens Fremtid i Fare. Alle bevabnede Bander og stoicnde For- samlinger ville med Magt blive sprængte fra hinanden. Pressefriheden er suspenderet. Trop- pecheferne i Provindserne Messina, Syracus og Palermo (a: hele Sicilien) ville i deres Haand forene hele ten militaire og civile Magt."" (Det er iovrigt en almindelig Mening, at Garibaltis egentlige Plan nu er fra Sicilien alene at gaae over til Nedreitalien for at stille sig i Spidsen af te ter organiserede Finskårer, medens hans Optråden paa Sicilien kun er en Diversion for ter at sysselscrttc sine Modstandere; men baade den italienske Regjcring og de Fransse have truffet deres Forholdsregler til at forhindre ethvert Ind- fald i PavcnS Gebcet. I.a Kraiice vil vide, at han har erklcrret sig beredt til at nedlægge sine Vaabeii, hvis den franske Regjcring efter Opfordring af den italienske for Europas Line overtager den Forpligtelse — som ogsaa Pal mcrstons Organ Alorn. I'< st stærkt har anbe .alet — inden en bestemt Fri st at remme Rom. Rnslant. Warschau, den 20de. „Feld-Auditoriatet"", som Krigsrettens Dom var forelagt, bar foran- tret JaroszynskiS Straf til at hcrnges; Storfyrst-Statholdcrcn har stadferstct denne Dom. (Tommen blev eregveret ten 21 Ce, Kl. 9 om Morgenen foran Citadellet). — A. ZamoySki, Archivarius ved Landcredltforcningen, er af Krigs- retten domt til (2 Aars strengt Arbejde i en side- risk Ferstninz og Tab af alle Stantsrcttighedcr for hemmelig med en Haandpressr at have trykt revolutionajre Brochurer: Statholderen har for- mildet Straffen til 6 Aar. Nortamertca. Newyork, den 5te. Sydens nye Pantser- vcrddrr paa Jamesfi., „Richmond"", rager knap en Fod op over Vandet; dens Vætdcrsnabel er 4 Al. lang; den forer 8 svare Kanoner og er stcrrkere pantsrct end „Merrimac"". Paa Uazoofl. bar Syden (foruden „Arkansas"") ogsaa pantsret Sitar vf te West (22 Kan.) og Dampvædtcren Webb; sammesteds stal Syden ogsaa have 30 andre Dampstibe, som frelste sig dcrben fra New- orlcans, hvorfra de medbragte en Mceugde Kanoner og Krigsfornodenbcder. (Dertil komme te i England for Sydens Regning byggede Pant- serstibe. Et af disse „Nr. 290"", meget stort, stcrrkt, hurtigt sejlende og sodyztigt, bygget ved Liverpool, er allerede paa Veien til America ; for at passe paa det laae Nordens „Tuscarora"" foran Havnen ; cn smuk Tag dampede „Nr. 290"" ned ad Floden Mersey, som tet syntes, paa cn Pro- vetour med en Mængde Herrer og Damer og",doms_aviser_page:uuid:b0f1cc6c-a0c1-4899-b404-e1b90cd53033,doms_aviser_edition:uuid:8246d035-1249-42b6-bb4c-1d635b8a646f,doms_aviser_title:uuid:7f6084e3-521f-433b-8451-73a897cdc053,viborgstiftstidende 1862-08-25 001,viborgstiftstidende,1,1,Viborg,Rom\nFeld\nKrig\nNorden\nVandet\nSpidsen\nAars,"10.1468686071,57.3407021087\n9.23751020417,56.0992288801\n8.33187971864,56.3430354264\n9.26238627273,54.8907965043\n10.2779102718,55.1178190331\n9.44504298279,56.3526174343\n11.6175221873,55.0813741731\n9.51368182691,56.8025344518",-1.92134920634922
http://www2.statsbiblioteket.dk/mediestream/avis/record/doms_aviser_page%3Auuid%3A447ab61f-3794-443e-9381-efa6abaa6bf8,doms_newspaperCollection:uuid:447ab61f-3794-443e-9381-efa6abaa6bf8-segment_2,1862-09-06T01:00:00Z,51.8,0.482,"Ten Funderske Tobaksfabrik i Aarhuus.\nEfter at have antaget en Mester, ker i 17 Aar har arbejdet paa Nobels Tobaksfabrik i Kjobenharn (deraf de forste 9 Aar bos Fabrikens tidligere Eier, Hr. Kastrup), anbcfaker jeg til Thrr. Handlendes og Forbrugeres Opmærksomhed mit Lager af forfljellige saarel fine som ordinairc Rog-, Skraa- og Cnuuskobakker. . 2folge Iiidenrigsministcrieis Eirculairc af 9de Juni 1856 (see TepatementStidendeii fer Ilde Juni f. A.) er det forbudt TobakSfabrikanterne i Kongeriget at benytte Runkclroebladc til Ind- blanding i Tobakker. Eirculairet, der alene er udfærdiget til Kongeriget og ikke til Hertuatommerne Slesvig og Holsten, lyder saaledes: Bet er kommet til Ministeriets Kundflab, at der paa sterc Steder i Kongeriget ved Tobaks- fabrikationen er anvendt Runkelrcebladc under Ravn as ..Oblaner Tobak til Indblanding imellem To bakken, og at denne Blanding derefter er forhandlet som Tobak. Da saadan Misbrug er til Fordærvelse for de Tcbakofabriker. som levere usorsalstede Varer til Tab >cr Statskassen og til Forurettelse for de private Ccnsumcnter, stnldc man tjenstligst anmode Hr' (Tit.) om ar paalægge samtlige Retsbetjente i del Dem anbetrocde i.mt al hare ucie Indseende med de i deres Jurisdiktioner etablerede Todaksfabriker, saml i Tilfælde, hvor den omhandlede"" eller lignende Varcfortalstninger opdages, uden Ophold at foranstalte Vedkommende tiltalt til Straf og Unkaiælrclse citer Frd. I4de Jum l7b« Cap. II $ 8, cfr. Frd. Ilte April I8!o $ 49. Om de Sager af denne Natur, som maatte forefalde i Amtet, forventer Ministeriet at modtage Indberetning. Jeg finder mig foranlediget til at at bekjendtgjore, at i mine Costakkor finde« ingen .Uunliefroefifnde esser andre Cissætninger, hvorom Enhver fct Kan overlikuife lig ved at udryste Tobakken i Haanden og fmage paa Zssadcne, der asse have en reen Cobak«lmag. Z Toknkker. der ere forfalskede med Aunkefrorbfnde. Siende« disfe Zssade DciueO, at de ere meget lyse, i Regelen endnu lysere end Zltarysand«-Toitak«Illadene. og uden 8mag. Forsoget cr saa fimpelt at anstille, og Runkclroebladene saa lette at stjclne. især ved Hjælp as Smagen, at enhrer Tobaksryger paa den angivne Maale selv kan bekomme, om hans Tobak cr sorsalffet eller ei. Tel er en Selvsolge. at den med Roeblade sorsalstede Tobak kan leveres meget billigere end den usorfolflcde ; de Forbrugere, der fremfor Alt oiiffe en billig Tobak, gjores imidlertid opmærksomme paa, at de med storre Fordcel ljobc reen Tobak, som de da selv efter Behag kunne blanke med hjemmelende Blade eller Uiter, end de udgive dereS Penge til en Blanding af Tobak cg Runkelroeblade. Ten Funderfte Tobaksfabrik i Aarhuus, den 26« Juli 1862.\nTh. Lbvistgaart.\nMine Tobakker, deriblandt den vclbekjendte „P. Funkers Zomfrutobak\nRr. som jeg stal bestræbe mig for at levere frisk og kraftig, faacS i Viborg\nhos Thrr. R. P. Holmgaard, A. W. Sandberg, Carl Sandberg, G. Andersen, Sorcn Moller,\nF. C. Essemann, Martin Fischer. I Krogh. A. Jensen og H. H. Dige.",doms_aviser_page:uuid:447ab61f-3794-443e-9381-efa6abaa6bf8,doms_aviser_edition:uuid:4b85b9a4-1428-43ff-925f-b317a8f2f246,doms_aviser_title:uuid:7f6084e3-521f-433b-8451-73a897cdc053,viborgstiftstidende 1862-09-06 001,viborgstiftstidende,6,1,Viborg,Slesvig\nKastrup\nViborg,"10.0473406515,56.6761094867\n10.3583779757,56.3813122469\n9.40176695552,56.4443347362",12.210669047619055
http://www2.statsbiblioteket.dk/mediestream/avis/record/doms_aviser_page%3Auuid%3Ac19c450c-05d4-47a7-8699-db466bed9a80,doms_newspaperCollection:uuid:c19c450c-05d4-47a7-8699-db466bed9a80-segment_3,1862-09-17T01:00:00Z,57.2,0.428,"Vogn tilveje og faoe den Tilstadekomne fort til Kbbavn. Dennes trc Born. i en Alder af 8 — 12 Aar. vare narvarende. hvilket forogede det Ubyg- grlige i det sorgelige Optrin. Nykjobing i Sjalland, den 13te Septbr. 2 Rervig indtraf i Sondags Cftermitdags et af te sorgelige Tilfalde, som desvarre altfor hyppig soranlidiges ved uforsigtig Omgang med Sky- devaaben. En der boende Gaardmands 19aarigc Son havde nemlig taget Faderens Bosse for at strdc Skader. Medens ban udenfor Huset talte med Gaardens 17aarigr Tjenestekarl, gik Skuddet af og ramte denne i Underlivet, sodedes at den Ulystelige dcde cni Natte«. (ByenS Av.) Nonne, den 12te September. Ved det id ag paa Nonne Naodstne stedfundne Valg asen Lands lhingsmand i Hr. Pastor Mossins Sted, valgtes Hr. Eapr. og Farver O. E. Sonne i Ncro med 24 Stemmer. — Hr. Assessor, Amtsforvalter Jensen her i Byen erholdt 18 Stemmer. (23. A.) Foruden de akterede mcddeclte Udnavnelser, som sandt Sted ved Hs. Maj. Kongens Nar rarclse i Odense, er endvidere, som vi erfare, Propr. Lindegaard til Raastrup ndnavnt til Ja germestcr og Stambnusbcsitdcr Moller til Ostrup gaard til Ridder af Danncbrogen. (Bl. Td.) Nyborg, den 13de September. Jgaar Ef tcrmidtags afgik ved en pludselig Tod, ester no gen Tids Evgclighed, Eommerccraad, Viinbandler Johan Frederik Sehalburg, R. af D. Han var en i c» videre Kreds kjendt og almeenogtet Mand, bvis Tod smertelig vil berore Mange; ved sin adle og retsindige Vandel samt opoffrende God- gjorcnbed efterlader han sig her et stjont og va rigt Minde. (Byens Av.) Ved Frederiks si ad vil man nu ogsaa, ifelge „Flcusb.Zeit."", opkaste saakaldte fremskudte Var- ker for at gjore Stedet holdbarer?. Man har begyndt med Skantsearbeitcr paa Titmarstersiten af Cideren og synes at ville anlagge en Slags Brobcved ved Eiderfargen. Tet var den Plads, hvorfra i sidste Krig Batteriet Christiansen bom barderede Freteriksstad, medens let ved sin Be liggenbet var saaledcs bestyttet, at det kun kunde foruroliges lidet. Hs. Ere. Indenrigsminister Lehmann, let saget af Amtmanden, Eonserentsraad Tahl, an koni i Torstags Formiddags til Fredericia fra Vejle paa Gjcnnemreiscn til Kjobenhavn. Efterat Hs. Epcell. havde bcscet den paatcrnkte Jernba nelinie og Banegaard i Byen, afholdtes der. ifolge „Fredericia Av./ et Mode i Comiteen for Til- vciebringtlsen af et Maleri til Naadhuussalcn, hvilket Hs. Ercell. fremlagte en af Sonne ud fort Skiize, idet han bemcrrkede, at Maleriet ef- ter dette Udkast vilde koste 2 a 3000 Rd. Mi- nistcrcn bemyndigedes derefter til at gjore Be stilling af Maleriet, og en Subflription sattcS strar igang, hvorved der indtegnedes et Belob af c. 500 Rd. Kl. 12 dccltog Ministeren i et i Anledning af hans Ncrrvcrrelse i Raadhnussalen arrangeret Festmaaltit. Ved Bordet herskede en scerdclks livlig og munter Stemning, og mange frrskjellige Skaaler bleve udbragte. Hs. Crcell. bcsogte senere ten i forrige Aar restaurerede Tri- nitatis Kirke og afreiste Kl. 4 til Strib, efterat ct Musikcorps og endeel af Byens Jndvaancre ved Havnen havde bragt Ministeren en Afskeds- hilsen. — Paa Tilbagerejsen til Kjobenhavn har Hs. Ercell. besogt Odense og Nyborg og beseet Arbejderne paa den fycnstc Jernbane. (Tbl ) Skjern, den Ilte September. Ved et igaar optaget Forhor har en lOaang Son af Gaard- mand Peter Lucassen i Skjern afgivet Bekjen- deise om at have paasat den Faderens Gaard den 2tcn Ts. overgaacde Ildebrand, og har soni Motiv til Gjerningcn angivet, at han var kjed af at vcrre hjcnime og onffede at blive sat i Tse- neste hos Frcmniede, hvilket LNske han haabede",doms_aviser_page:uuid:c19c450c-05d4-47a7-8699-db466bed9a80,doms_aviser_edition:uuid:50055187-0b13-43b7-96dc-2e63640ce47c,doms_aviser_title:uuid:7f6084e3-521f-433b-8451-73a897cdc053,viborgstiftstidende 1862-09-17 001,viborgstiftstidende,3,1,Viborg,Strib\nFrederiks\nVandel\nKrig\nBatteriet\nFredericia\nOdense\nSkjern\nSkader\nNyborg\nMinde\nByen\nVejle,"9.77670129556,55.5347011073\n9.25392992626,56.3417459694\n9.2162762294,55.7085414172\n9.26238627273,54.8907965043\n10.3628716766,57.1792049749\n9.72652538807,55.5538163271\n10.3884101631,55.3994475975\n8.49892955597,55.9485793386\n10.2099705469,56.3539169812\n9.52842602338,55.8148362943\n10.7887027026,55.3174675437\n10.3322936449,57.2851420463\n9.61918937877,54.8988033895\n8.39276925385,55.4329764527\n9.53703363175,55.7062908305\n9.54895683418,55.7122404466\n10.3151649698,55.2703446541\n8.48537294799,55.9505181776",5.822222222222209
http://www2.statsbiblioteket.dk/mediestream/avis/record/doms_aviser_page%3Auuid%3A69ef8152-4ecb-40a0-9451-17b417691e93,doms_newspaperCollection:uuid:69ef8152-4ecb-40a0-9451-17b417691e93-segment_7,1862-09-24T01:00:00Z,59.8,0.402,"Den Peter Poulsen, Thomas Christensen og JenS Peter Bosen tilhorende Gaard i Bolling er solgt til Hr. C. Hastrup af Bastrup for 25,000 Rd. Gaarden har et Areal af 100 Ttr. kand Ager og Eng, sor- trinlige Jorder, 40 Tdr. Land Stop. og en god Tor- vemvse; i Kjobet medfulgte hele Besætningen og en Deel Inventarium. (Kold. Av.) Dode. Kjobenhavn: Kobbersmedmester Chr. Meyer, 41 Aar; Huusgaardskarl hos Landgrev Wilhelm til HeSsen, H. Knudsen. 37 Aar. — Louiseholm ved Jæ- gerspriis : Forpagter H. Pcpp, 42 Aar. — Magleby xaa Bornholm: Gaardmand og Sognefoged I. Han- sen, 50 Aar. — Petershvile : Landvæsenselev I. Ror- bech. — Ringsted: A. Pedersen, 39 Aar. — Rurkio- bing: Enkemad. R. Hansen, 76 Aar. — Viby: H. Hansens Moder, Maren. 90 Aar. — Veile: Otto Hoyers Hustru, Jaeobine, s. Kaalund. — Horsens: P. Gregersen« Hustru, Jaeobine, s. Siobmann, 29 Aar. — Aalborg: Arbejdsmand A. Norholm, 43 Aar.",doms_aviser_page:uuid:69ef8152-4ecb-40a0-9451-17b417691e93,doms_aviser_edition:uuid:0d242013-9694-4db2-8326-ba5dd6d8eb2a,doms_aviser_title:uuid:7f6084e3-521f-433b-8451-73a897cdc053,viborgstiftstidende 1862-09-24 001,viborgstiftstidende,3,1,Viborg,Magleby\nBastrup\nViby\nHastrup\nPetershvile\nHorsens\nAalborg\nRingsted\nBornholm\nAger,"10.7142127345,54.7727735346\n11.3211681142,55.2337943599\n12.3380110776,55.3666093623\n12.4815126192,54.9847340907\n12.2717137048,55.8211282364\n10.2993181587,55.520765685\n11.1335084183,55.6351012803\n10.1478961977,56.1199914531\n12.0198695735,55.5513401242\n9.84187854066,55.4549418967\n10.6835408556,55.4965941652\n10.0003531061,56.5374680857\n10.043846083,56.8152001461\n9.98860732712,56.8972536846\n9.85153350048,55.8551660724\n9.93146311931,57.025292765\n9.91683917278,57.0428743893\n11.7865717336,55.4380297704\n11.7981254442,55.4446609467\n14.9152398707,55.1871940445\n8.20659333574,55.8883604096\n8.27012497368,56.5792863856\n8.16670092486,56.5624733541\n8.65113614138,55.9533990612",-0.9074074074074101
http://www2.statsbiblioteket.dk/mediestream/avis/record/doms_aviser_page%3Auuid%3Ae8011eaa-e09d-4c65-9715-6cabd62e7f07,doms_newspaperCollection:uuid:e8011eaa-e09d-4c65-9715-6cabd62e7f07-segment_5,1862-10-02T01:00:00Z,51.4,0.486,"Svea Hosret fcat nylig afsagt Dom i en Sag, hvvrveb den har idømt Fabricant W. F. Wærn en Bede af 26,573 Rb. 77 Ore for ikke at have giort tilstrækkelig Anmeldelse om det paa hans Fabrik Forarbejdede. Af Boden tilsalder Halvdelen Angiveren, z Staten og j den offentlige Anklager. Det engelste Ugeblad Oure » weck fortæller i en Artikel om Prinbsen af Wales s Forlovelse følgende Anecdote fra 1807. En hemmelig Artikel i Tilfiler- freden imellem Frankrig og Rusland bestemte, at Napoleon ikulde kunne bemægtige fig den danikc Flaade for at bruge den til Landgang i England. Denne Af- tale robedes til England af Portugal, som betingede fig Hemmeligholdelse. Den engelffe Regjermg kom. som bekjendt. Napoleon i Fork,obet ved selv at for- lange den danffe Flaade udleveret. Forgjæves bavde Georg I II, Caroline Maibildes Broder og altsaa Kron- xrindS Frederiks Onkel, sat fig imod fil Ministeriums Plan. En Mr. Jackson blev sendt til Danmark for at fordre Flaaden udleveret, men kunde formedelst Lof- tet til Portugal ikke nærmere motivere fin Fordring. Da dan kom hjem og aflagde Georg >>> en Beretning om fin Audicnts bos Kronprindsen, afbrød Kong Georg ham med det Sporgsmaal, cm Samtalen havde sun- det Sled i en af Slottets øverste Etager. ,,Nei, Ds. Maj."", svarede Jackson, „det var i Stueetagen"". — „Det var heldigt for Dem"", udbrod Kongen, „tbi, havde Kronprindsen slægtet mig paa, saa havde han sparket Dem ned ad alle Trapperne"". (Est. „Dgbl."") Ifølge Timrs er England« Hrcdehøst iaar næsten en GienncmsnitShøst: de øvrige Kornsorters og Kartof- lernes Udbytte er fortrinligt. Dertil kommer, at Eng- laud fra Nordamerika, som siden Krigens Begyndelse kun bar hart sit Korn til at betale fine saa betydelige Jndførflcr af Vaaben, Munition vsv. fra England, i<jor og iaar har havt en uscrdranlig stærk Hvede- og Meelindsørsel. Og i America er Kornhøsten iaar over- ordentlig rigelig. Est' Franskmand. Marimc de Camp, fortæller bl. A. Følgende om den Fare for et Schisma, hvormed Pa> ren« stivsindede Vægring ved at opgive fin verdslige Magt truer den katholfle Kirke i Italien: Til Svar paa pet Brev, som Bisperne tilsendte Paven efter den høltidcligc Cancnjscring af de iapanflc Martyrer og hvori te taklede Paven for bans Haarnakkcnhed og lovede ham deres Understøttelse, undertegnede 8, 500 italienske Præster et Manifest, som fordrer Ophævelsen af den verdslige Magt. Denne Spaltning er Grun- den til, at Gejstligheden ikke har kunnet giore Victor Emanuels Regjerinq synderlig Skade. Ogsaa har Protestantismen flaffct fig Indpas ikke blot i Florcnts, men endog i Neapel, hvor der 3 Gange ugentlig hol- des protestantifle Forsamlinger, hvori der debatteres om Religionen. En Akten var den katholfle Kirkes Pomp og Pragt i Modsætning til den protestantifle Simpelhed paa Bane. Der reiste fig en Mand, som sagde: ,Jeg er Kok. Naar mui Herre bestiller en Postej hos mig, saa siger han mig, om den stal være rund eller fiirkantet. Saa tager jeg fat paa Arbejdet og laver Postejen, saadan som min Herre for- langer, da jeg jo er i hans Tjeneste. Men hvad gjør nu ban 's Han fliærer den op. ødelægger øjeblikkelig Fayonen og stikker ind i Hylsteret for at pille de Varer ud, som jeg har indelukket der. Accurat saadan gaaer det ogsaa med denne ydre Cultus: den er ikke Andet end Hylsteret for det. hvorpaa det egentlig kommer an, bvad der er vore Pligter; den er Stoffet, hvorunder Aanden er fliult. Naar nu Pligterne ere saa store, at vi kunne have nok at gjore med at opfylde dem, hvad flulle vi saa med denne Cultus, med dens Cere- monicr og med al denS Stads? En god Gjerning er .dog bedre end en Procession, en Almisse er dog mere end en Messe"". Især i Calabrien udbreder Pro- testantismcn sig. Man flulde troe, at den pavevenlige boierc Gejstlighed med Held vilde have kunnet mod- arbeide Recrutudflrivningen i Neapel; men, medens Bcurbonerne af de 24.000 Mand, de aarligt udflreve, højst fik 14,(n>o sammenskrabede, og det ikte »den Gensdarmernes Hjælp, idet de ovrige lob væk eller støbte fig frie ved Bestikkelser, vare af de i Dccbr. >361 uddrevne 36,000 Md. i Juni d. A. allerede 28,000 mødte uden at drive« til Sessionen af Gens- darmcr; ja. i de as Røvervæsenet meest hiemsogte Pro- rindser Capltanata og Bafilicata. var der ikke blot ikke en eneste Gienstridig blandt de Værnepligtige, men de leverede endog et temmelig betydeligt Antal Fri- villige. Overhovedet er Ideen om Italiens Eenhed trængt dybt ind selv hos Neapels Befolkning: de bourbcnfle"" Bander ere simpelt hen kun Rovere af samme Slags, som under Bcurbonerne stadigt hjem- søgte Kongeriget Neapel (mod hvilke s. Er. selv Kon- gen af Preussen ved sit Besøg 1822 maatte beskyttes ved en Opstilling af 10,000 Md. imellem Pavestatens Grændse og Neapel). For 5 Aar siden spurgte Mar. te Camp en Mand i Neapel: „Er De en Italiener?"" ..Nci, jeg er en Neapolitaner"", svarede han. Og Calabrcsercn vilde dengang ikke gjælde for en Nea- polilaner, Sicilianeren vilde hverken forverlcs med en Neapolitaner eller med en Calabreser; nu hedder I det derimod: „Jeg er en Italiener fra Neapel, fra I",doms_aviser_page:uuid:e8011eaa-e09d-4c65-9715-6cabd62e7f07,doms_aviser_edition:uuid:0dc27092-d3e4-4776-977b-a7541532c6ab,doms_aviser_title:uuid:7f6084e3-521f-433b-8451-73a897cdc053,viborgstiftstidende 1862-10-02 001,viborgstiftstidende,3,1,Viborg,Frankrig\nFrederiks\nOre\nSlottet\nRusland\nBoden\nSvea\nOure\nPortugal,"10.3426132261,56.3014420551\n9.68804668151,56.0925269907\n9.25392992626,56.3417459694\n10.7195424589,54.813009651\n10.5184355137,55.2963129174\n11.2093857571,54.8021393816\n12.0679776145,54.8831855536\n10.0361245542,55.5086450783\n11.867651022,55.0090391493\n9.61544032749,55.2890774569\n12.3998072913,56.0853826198\n9.6169389714,57.055131442\n10.6428689225,55.0596536822\n10.723685569,55.1191222044\n9.19791323879,55.0197222176",39.6222222222222
